info@szkola.be;Polskie Centrum Kszta³cenia im. Jana Paw³a II w Brukseli (Centre d’Enseignement Polonais Jean-Paul II ASBL)
malgorzata.pierzchalska@pandora.be;Œwietlica Polska w Maasmechelen
hannadrzewiecka@gmail.com;Towarzystwo Belgijsko-Polskie prow. Luksemburg
polambbdod@skynet.be;Towarzystwo Polek im. œw. Jadwigi w Genk
chris.skot@easynet.be;Towarzystwo Przyjació³ Fundacji Jana Paw³a II w Brukseli
pms@grodno.by;Towarzystwo PrzyjaŸni Polsko-Belgijskiej
contact@EnsembleSpotkanie.com;Zespó³ Pieœni i Tañca Polskiego "Spotkanie"
dorota_dobrzynska@hotmail.com;Zespó³ Przyjació³ Aarschot-Polska
info@jasnawoda.be;Zespó³ "Wis³a" w Genk
misjonarki@mchr.pl;Zgromadzenie Sióstr Misjonarek Chrystusa Króla dla Polonii Zagranicznej (Misjonarki Chrystusa Króla) w Belgii
polambbod@skynet.be;Zjednoczenie Polskie w Belgii
iduboidaische@yahoo.fr;Zwi¹zek Harcerstwa Polskiego (Kr¹g Starszoharcerski) w Belgii
bvpo1978@gmail.com;Ko³o I Dywizji Pancernej w Belgii
info@network-pl.org;Zwi¹zek Polakow w Belgii - Oddzia³ w Brukseli
info@network-pl.org;Zwi¹zek Polakow w Belgii - Oddzia³ w Houthalen
info@Polonia.be;Zwi¹zek Polaków w Belgii - Zarz¹d G³ówny
balcerzakl@belgacom.net;Zwi¹zek Polaków w Belgii - Okrêg Limburgia Oddzia³ Beringen
dorota_dobrzynska@hotmail.com;Zwi¹zek Polaków w Belgii - Oddzia³ Charleroi
balcerzakl@belgacom.net;Zwi¹zek Polaków w Belgii - Okrêg Limburgia Oddzia³ w Maasmechelen
info@network-pl.org;Zwi¹zek Polaków w Belgii - Okrêg Limburgia Oddzia³ w Genk-Waterschei
ptaszynski.translations@skynet.be;Zwi¹zek Polskich Kombatantów i Weteranów 1 Dywizji Pancernej Genera³a Stanis³awa Maczka w Belgii
iduboisdaische@yahoo.fr;Zwi¹zek Spo³ecznoœci Polskiej "Vector"
klub_polski@wp.pl;"Echa Polesia”
dubikowski@yahoo.com;"G³os znad Niemna”
zamowienia@ltw.com.pl;"Grodzieñskie S³owiki" Klub Polskich Tradycji Narodowych
estaniukiewicz@franciszkanie.pl;"List do Ciebie” Biuletyn Informacyjny
syczewska@tut.by;"Polskie S³owo z Baranowicz”
pms@grsu.grodno;"S³owo Ojczyste”
slowozycia@mail.grodno;"S³owo ¯ycia” Gazeta Religijno-Informacyjna
irendo@wp.pl;"Ziemia Lidzka”
jadwigakopec42@gmail.com;1 Grodzieñska Dru¿yna Harcerska "Victoria” im. Stefana Batorego
jadwigakopec42@gmail.com;Biblioteka Polska przy Polskiej Macierzy Szkolnej na Bia³orusi
biblioteka@wsm.opole.pl;Biblioteka Polska w Grodnie
shpakov@grsu.unibel.by;Biblioteka Zwi¹zku Polaków na Bia³orusi w Baranowiczach
ebma@interia.pl;Biblioteka Zwi¹zku Polaków na Bia³orusi w Witebsku
belcentar@gmail.com;Centrum Charytatywne dla Dzieci i M³odzie¿y na Bia³orusi
glosznadniemna@mail.grodno.by;Chór "Echo Grodna"
zpb@zpb.org.pl;Chór "G³os znad Niemna"
dubikowski@yahoo.com;Chór "Nowogródczyzna"
syczewska@tut.by;Dom Polski w Baranowiczach
dom-polski@rambler.ru;Dom Polski w Mohylewie
ms@grsu.grodno;Dzieciêcy zespó³ teatralny przy Polskiej Szkole Spo³ecznej w Nowogródku
tpbakalisz@op.pl;Grodzieñskie Zjednoczenie Spo³eczne "Klub Polskich Tradycji Narodowych”
tppm@cci.by;Izba Przemys³owo-handlowa Zwi¹zku Polaków na Bia³orusi
Kikbresta_2004@mail.ru;Klub Inteligencji Katolickiej w Brzeœciu
batory.grodno@tut.by;Klub Sportowy "Batory” w Grodnie
lmasyk@um.bielawa.pl;Klub ¯eglarski przy Polskiej Szkole w Grodnie
biuro@ncpp.opole.pl;Klub-Muzeum im. Czes³awa Niemena
zsmosina@powiat.poznan.pl;Ko³o Nauczycieli w Lidzie
ebk@polkainternational.com;Miêdzynarodowa Asocjacja Polskich Kobiet "Polka International” Oddzia³ w Brzeœciu
irendo@wp.pl;Miêdzynarodowa Asocjacja Polskich Kobiet "Polka International” Oddzia³ w Grodnie
ebk@polkainternational.com;Miêdzynarodowa Asocjacja Polskich Kobiet "Polka International” Oddzia³ w Lidzie
syczewska@tut.by;Organizacja Charytatywna "Dom Mi³osierdzia” przy Rzymsko-Katolickiej Parafii w Brzeœciu
syczewska@tut.by;Polska Macierz Szkolna na Bia³orusi
fundgon@gmail.com;Polska Szko³a Spo³eczna w Brzeœciu
marta0801@op.pl;Polski Narodowy Zespó³ Pieœni i Tañca "Lechici"
reklama.lca@gmail.com;Polskie Towarzystwo Lekarskie na Bia³orusi
skowronki@tut.by;Polskie Towarzystwo Naukowe w Miñsku
wza@zhp.pl;Republikañskie Zjednoczenie Spo³eczne "Harcerstwo”
chabry@tut.by;Spo³eczne Zjednoczenie Harcerstwa Polskiego na Bia³orusi
hormisyjne@box43.pl;Stowarzyszenie Apostolstwa Katolickiego (Pallotyni) na Bia³orusi
info@polish-spk-foundation.org.au;Stowarzyszenie Kombatantów Polskich w Grodnie
stowpm2001@tut.by;Stowarzyszenie Lekarzy Polskiego Pochodzenie w Miñsku
d.halama@ckl.pl;Stowarzyszenie Pielêgniarek i Po³o¿nych na Bia³orusi
nfo@udskior.gov.pl;Stowarzyszenia Polaków Ofiar Represji Politycznych - Sybiraków na Bia³orusi
polesie@polinfo.net;Stowarzyszenie Spo³eczne Polska Macierz Szkolna "Polesie" w Brzeœciu
tsykaliuk.anatolii@mail.ru;Stowarzyszenie Spo³eczno-Kulturalne "Polonia”
jadwigakopec42@gmail.com;Towarzystwo Kultury Polskiej Ziemi Lidzkiej
chabry@tut.by;Towarzystwo M³odzie¿y Polskiej przy Zwi¹zku Polaków na Bia³orusi
pms@grsu.grodno.by;Towarzystwo Polskich Plastyków na Bia³orusi
ofmcapwawa@gmail.com;Zakon Braci Mniejszych Kapucynów
prow_wwa@nazaretanki.pl;Zgromadzenia Sióstr Najœwiêtszej Rodziny z Nazaretu
misje@scj.pl;Zgromadzenie Ksiê¿y Najœwiêtszego Serca Jezusowego (Sercanie) na Bia³orusi
labkowd@gmail.com;Zgromadzenie Najœwiêtszego Odkupiciela (Redemptoryœci) na Bia³orusi
biuro@zbieramto.pl;Zgromadzenie Najœwiêtszego Serca Pana Jezusa (Sercanie) na Bia³orusi
misjonarki@mchr.pl;Zgromadzenie Sióstr Misjonarek Chrystusa Króla dla Polonii Zagranicznej (Misjonarki Chrystusa Króla) na Bia³orusi
domgen@dominikanki.pl;Zgromadzenie Sióstr œw. Dominika (Dominikanki) na Bia³orusi
rzecznik@werbisci.pl;Zgromadzenie S³owa Bo¿ego (Werbiœci) na Bia³orusi
chabry@tut.by;Zwi¹zek Harcerstwa Polskiego na Bia³orusi
ambasada@minsk.polemb.net;Zwi¹zek Polaków na Bia³orusi
zgromadzenie@dominikanki-misjonarki.org;Siostry Dominikanki Misjonarki Jezusa i Maryi (Dominikanki Misjonarki) w Boliwii
cemaja@lsinter.nettel;Rada Polonii w Boœni i Hercegowinie
malgorzatabos@gmail.com;Stowarzyszenie Polaków i Przyjació³ "Mak"
	snmrs@teol.net;Stowarzyszenie Polaków w Banja Luce
polsa@lsinter.net;Towarzystwo PrzyjaŸni Boœniacko-Polskiej
polsa@lsinter.net;Wspólnota Obywateli Polskiego Pochodzenia w Tuzli
wanda.vujisic@gmail.com;Zwi¹zek Ba³kañskich Organizacji Polonijnych "Polonika Ba³kanika"
	opstina@prnjavor.ba;Zwi¹zek Mniejszoœci Narodowych "Ma³a Europa" w Prnjavorze
tirana.amb.sekretariat@msz.gov.pl;Zwi¹zek Polaków Miasta Banja Luki
reitor@polska-misja.com.br;"Echo Polonii Brazylijskiej”
revista@polonicus.com.br;"Gazeta Polska w Brazylii"
j.mazurek@mhprl.pl;"G³os Polonii Paulistañskiej”
danagaw@amu.edu.pl;"Lud"
marcin.bochenek@awf-bp.edu.pl;"Podlasie" Zespó³ folkloru polskiego
revista@polonicus.com.br;"Polonicus. Revista de reflex?o Brasil-Polônia"
revista@polonicus.com.br;"Projeç?es. Revista de estudos polono-brasileiros"
maristela_fronczak@hotmail.com;Brazylijskie Towarzystwo Kultury Polskiej im. J. Pi³sudskiego
braspol@braspol.org.br;Centralna Reprezentacja Wspólnoty Brazylijsko-Polskiej BRASPOL
polonia@dialdata.com.br;Centrum Kultury Polonijnej w Kurytybie
polonia@dialdata.com.br;Chór im. Jana Paw³a II
maristela_fronczak@hotmail.com;Dom Kultury Polskiej im. R. Sanguszki w S?o Paulo
embpolon@nutecnet.com.br;Dom Polski Towarzystwa Dobroczynnego "Polonia”
dompolski32@yandex.ru.;Dom Polski Towarzystwa Polskiego "Odrodzenie"
edsoncaec@hotmail.com;Dru¿yna harcerska "Orze³ Bia³y” w S?o Paulo
polonia@dialdata.com.br;Instytut Brazylijski Kultury Polonijnej
irmasdejesusmisericordioso@hotmail.com;Parafia Chrystusa Króla w Campo do Tenete
braz@chrystusowcy.pl;Parafia Matki Bo¿ej Jasnogórskiej w Aurea
braz@chrystusowcy.pl;Parafia Matki Bo¿ej Jasnogórskiej w Rio de Janeiro
iber@uw.edu.pl;Parafia Matki Bo¿ej Jasnogórskiej w Virmond
revista@polonicus.com.br;Parafia Matki Bo¿ej Ró¿añcowej w Rio Claro do Sul
amalker@amalker.com;Parafia Matki Bo¿ej z Nazaretu w Kurytybie
revista@polonicus.com.br;Parafia Niepokalanego Serca Maryi w Quedas do Iguaçu
polonia@dialdata.com.br;Parafia Personalna pw. œw Stanislawa Biskupa i Meczennika w Kurytybie
smardzewice@franciszkanie.pl;Parafia Œwiêtej Anny w Santana
polonia@dialdata.com.br;Polbras – Federacja Organizacji Polskicha
maristela_fronczak@hotmail.com;Polonijne Porozumienie Organizacyjne w S?o Paulo
info@piast.se;Polonijne Towarzystwo Kulturalne w Cascavel
polonia@polonia.sp.ru;Polonijny Zespól Folklorystyczny "Wis³a"
info@zofiaczechlewska.pl;Polonyjny Zespó³ Folklorystyczny "Wawel”
reitor@polska-misja.com.br;Polska Misja Katolicka w Brazylii
maristela_fronczak@hotmail.com;Polskie Stowarzyszenie Kulturalne w Aguia Branca
aulasdepolones@yahoo.com.br;Polskie Stowarzyszenie Kulturalno-Oœwiatowe "Apolec"
polonia@dialdata.com.br;Polskie Towarzystwo By³ych Kombatantów Parana
polonia@dialdata.com.br;Polskie Towarzystwo Dobroczynno-Kulturalne w Kurytybie
braz@chrystusowcy.pl;Prowincja Towarzystwa Chrystusowego p.w Matki Boskiej Niepokalanie Poczêtej w Ameryce Po³udniowej
ssmilwwa@wa.home.pl;Siostry Mi³osierdzia œw. Wincentego a Paulo (Szarytki) w Brazylii
hormisyjne@box43.pl;Stowarzyszenie Apostolstwa Katolickiego (Pallotyni) w Brazylii
info@polish-spk-foundation.org.au;Stowarzyszenie Kombatantów Polskich (SPK)
maristela_fronczak@hotmail.com;Stowarzyszenie Polskie "Orze³ Bia³y” w Aguia Branca
polonia@dialdata.com.br;Towarzystwo  "Uni?o Juventus” w Kurytybie
cristiane@imoveisideal.net.br;Towarzystwo "Polonia” w Santa Catarina
regina.jurkowska@msz.gov.pl;Towarzystwo "Varsovia” w Sao Bento do Sul
aristela_fronczak@hotmail.com;Towarzystwo Dobroczynne "Polonia” w Rio de Janeiro
maristela_fronczak@hotmail.com;Towarzystwo Polsko-Brazylijskie im. Marsza³ka Pi³sudskiego w Kurytybie
ortis@ortis.com.pl;Towarzystwo im. Romana Sanguszki w S?o Paulo
revista@polonicus.com.br;Towarzystwo im. Tadeusza Koœciuszki
maristela_fronczak@hotmail.com;Towarzystwo Kulturalne w Abranches
misjonarki@mchr.pl;Zgromadzenie Sióstr Misjonarek Chrystusa Króla dla Polonii Zagranicznej (Misjonarki Chrystusa Króla) w Brazylii
cssjkrk@rubikon.pl;Zgromadzenie Sióstr œw. Józefa Oblubieñca NMP (Józefitki) Delegatura Brazylijska
rzecznik@werbisci.pl;Zgromadzenie S³owa Bo¿ego (Werbiœci) w Brazylii
festiwal@amu.edu.pl;¯eñski Chór Polski w S?o Paulo
reklama@polishphonebook.com;"Informator Polonijny”
irendo@wp.pl;"Przegl¹d Polsko-Bu³garski”
victoriatur@abv.bg;Mauzoleum W³adys³awa Warneñczyka w Warnie
maria.daczewska@abv.bg;Polonijno-Szkolny Klub Olimpijczyka im. I. Szewiñskiej w Sofii
maria.daczewska@abv.bg;Polskie Stowarzyszenie Kulturalno-Oœwiatowe im. W³adys³awa Warneñczyka w Bu³garii
szkola_plw@hotmail.com;Stowarzyszenie Polski Klub w Warnie
mediolan@orpeg.pl;Szkolny Punkt Konsultacyjny w Warnie
kuria@zmartwychwstancy.pl;Zgromadzenie Zmartwychwstania Pana Naszego Jezusa Chrystusa (Zmartwychwstañcy) w Bu³garii
emigracja@episkopat.pl;Polska Misja Katolicka w Chile
afery@poczta.fm;Zjednoczenie Polaków w Chile im. Ignacego Domeyki
wq_123cn2000@yahoo.com.cn;Szko³a Polska przy Ambasadzie RP w Pekinie
kopernik.ptk@gmail.com;"Biuletyn informacyjny"
polska.szkola.zagrzeb@gmail.com;Polskie Towarzystwo Kulturalne "Fryderyk Chopin”
kopernik.ptk@gmail.com;Polskie Towarzystwo Kulturalne "Miko³aj Kopernik”
udruga.polonez@gmail.com;Polskie Towarzystwo Kulturalne "Polonez”
polska.szkola.zagrzeb@gmail.com;Szkolny Punkt Konsultacyjny przy Ambasadzie RP w Zagrzebiu
misje@scj.pl;Zgromadzenie Ksiê¿y Najœwiêtszego Serca Jezusowego (Sercanie) w Chorwacji
office@investinwariaandmazury.pl;"Polo News"
embassyofcyprus@neostrada.pl;Grupa Polonii w Nikozji
malwacypr@yahoo.co.uk;Towarzystwo PrzyjaŸni Cypryjsko - Polskiej
wanda.vujisic@gmail.com;Stowarzyszenie Polaków w Czarnogórze
info@glosludu.cz;"G³os Ludu” Gazeta Polaków w Republice Czeskiej
kurier@kurierpraski.pl;"Kurier Praski”
ogniwopl@gmail.com;"Ogniwo” Pismo dla dzieci i m³odzie¿y
klub@wiarus.org;"Wiarus”
info@pctesin.cz;"Zwrot”
legowicz@rkka.cz;Biblioteka Regionalna w Karwinie Oddzia³ Literatury Polskiej
kontakt@zaolzie.org;Fundacja  "Zaolzie”
info@gympol.cz;Gimnazjum z Polskim Jêzykiem Nauczania w Czeskim Cieszynie
kontakt@zaolzie.org;Harcerstwo Polskie w Republice Czeskiej
polonusbrno@post.cz;Klub Polski "Polonus" w Brnie
sekretariat@polskykapital.cz;Klub Polskiego Biznesu w Republice Czeskiej
info@polish-spk-foundation.org.au;Ko³o Polskich Kombatantów w Republice Czeskiej
kongres@polonica.cz;Kongres Polaków w Republice Czeskiej
macierz.szkolna@seznamcz;Macierz Szkolna w Republice Czeskiej
prezes@pzkosuchagorna.cz;Miejscowe Ko³o Polskiego Zwi¹zku Kulturalnego w Suchej Górnej
pzkokarwina@pzkokarwina.cz;Miejskie Ko³o Polskiego Zwi¹zku Kulturalno-Oœwiatowego w Karwinie
zg@pzko.cz;Polski  Zwi¹zek Kulturalno-Oœwiatowy
info@collegiumcanticorum.cz;Polski Chór Mieszany "Collegium Canticorum"
plastycy.sap@seznam.cz;Polskie Stowarzyszenie Artystów Plastyków w Republice Czeskiej
	am@arsmusica.cz;Polskie Towarzystwo Artystyczne "Ars Musica"
spolek.avion@email.cz ;Polskie Towarzystwo Medyczne w Republice Czeskiej
info@ptts-beskidslaski.cz;Polskie Towarzystwo Turystyczno-Sportowe "Beskid Œl¹ski”
kpwp@seznam.cz;Stowarzyszenie "Klub Polski” w Pradze
biuro@sekretariat-misyjny.pl;Stowarzyszenie Apostolstwa Katolickiego (Pallotyni) w Czechach
spolek.avion@email.cz;Stowarzyszenie Dziennikarzy Polskich w Republice Czeskiej
anna.dzieciol@sep.com.pl;Stowarzyszenie Elektrotechnikow Polskich w Republice Czeskiej
spolek.avion@email.cz;Stowarzyszenie Emerytów Polskich w Republice Czeskiej
info@ptts-beskidslaski.cz;Stowarzyszenie In¿ynierów i Techników "TechniPol” w Pradze
spolek.avion@email.cz;Stowarzyszenie M³odzie¿y Polskiej w Republice Czeskiej
spolek.avion@email.cz;Stowarzyszenie Osób Pracuj¹cych i Ucz¹cych siê za Granic¹ w Republice Czeskiej
legowicz@rkka.cz;Stowarzyszenie Przyjació³ Polskiej Ksi¹¿ki
legowicz@rkka.cz;Stowarzyszenie Rodzina Katyñska
pzstri1b@volny.cz;Szko³a Podstawowa i Przedszkole imienia Gustawa Przeczka z Polskim Jêzykiem Nauczania w Trzyñcu
przedszkole.stonoga@seznam.cz;Szko³a Podstawowa i Przedszkole z Polskim Jêzykiem Nauczania w Suchej Górnej
cafe.avion@silesnet.cz;Towarzystwo "Avion" w Pradze
spolek.avion@email.cz;Towarzystwo Nauczycieli Polskich w Republice Czeskiej
ztf@silesnet.cz.;Zaolziañskie Towarzystwo Fotograficzne
spolek.avion@email.cz;Zrzeszenie Literatów Polskich w Czechach
ksiaznica@kc-cieszyn.pl;Zrzeszenie Œpiewaczo-Muzyczne "PrzyjaŸñ"
a2z.dtp@gmail.com;"Informator Polski”
pms@grsu.grodno.by;"Polski Informator Katolicki”
polski.zwiazek.soenderborg@gmail.com;Duñsko-Polski Zwi¹zek Kulturalny
aspekty@kuria.zg.pl;Instytut Polsko-Skandynawski w Kopenhadze
mail@ambpol.dk;Klub Mlodziezy Polskiej "Odnowa" w Kopenhadze
info@polish-spk-foundation.org.au;Ko³o By³ych ¯o³nierzy Armii Krajowej w Danii
pms@grodno.by;Kongres Polonii Duñskiej
roman@miedzianogora.dk;Muzeum - Izba Polska w Taagerup
info@polish-spk-foundation.org.au;Niezale¿ne Samodzielne Ko³o Stowarzyszenia Polskich Kombatantów w Danii
unia.nordycka@gmail.com;Nordycka Unia Oœwiaty Polonijnej (NUOP)
polonia@polonia.dk;"Polonia.dk" Portal Polonii Duñskiej 
szorc6@gmail.com;Parafia p.w. œw. Anny w Kopenhadze
szorc6@gmail.com;Polska Misja Katolicka w Danii
roman@smigielski.dk;'Polski Klub Dyskusyjny "Agora” w Kopenhadz/''e'
roman@smigielski.dk;Polski Zwi¹zek w Aalborgu
mail@ambpol.dk;Polski Zwi¹zek w Aarhus
mail@ambpol.dk;Polski Zwi¹zek w Naestved
polski.zwiazek.soenderborg@gmail.com;Polski Zwi¹zek w Sonderborgu
wojciech@adslhome.dk;Polskie Stowarzyszenie Spo³eczno-Kulturalne "Ognisko”
mail@ambpol.dk;Stowarzyszenie Polakow w Holbaek "Polonia"
info@polish-spk-foundation.org.au;Stowarzyszenie Polskich Kombatantów Kopenhaga
mail@ambpol.dk;Towarzystwo Duñsko-Polskie "Delta" w Holbaek
roman@miedzianogora.dk;Towarzystwo Krzewienia Oœwiaty Polskiej (TKOP) w Danii
mail@ambpol.dk;Towarzystwo Kultury Polskiej w Danii
mail@ambpol.dk;Towarzystwo PrzyjaŸni Polsko-Duñskiej
roman@smigielski.dk;Zrzeszenie Polaków w Danii
mail@ambpol.dk;Zwiazek Polakow w Danii Oddzial Fionia
mail@ambpol.dk;Zwiazek Polakow w Danii Oddzial Nykoebing
mail@ambpol.dk;Zwi¹zek Polaków w Danii "Jutlandia"
mfa@mfa.fo;Zwi¹zek Polaków w Danii Oddzia³ Kopenhaga
polonia@polonia.dk;Zwi¹zek Polaków w Danii Zarz¹d G³ówny
polski.zwiazek.soenderborg@gmail.com;Zwi¹zek ¯ydów z Polski w Danii
biuro@sekretariat-misyjny.pl;Stowarzyszenie Apostolstwa Katolickiego (Pallotyni) w Demokratycznej Republice Konga
misje.aniol@o2.pl;Zgromadzenie Sióstr od Anio³ów w Demokratycznej Republice Konga
behemot@email.com;Zgromadzenie Sióstr œw. Józefa Oblubieñca NMP (Józefitki) Delegatura Afrykañska - Demokratyczna Republika Konga
polonez.kair@gmail.com;"Polonez” Magazyn Informacyjny Polonii w Egipcie
info@zrp-e.com;Zwi¹zek Rodzin Polsko - Egipskich
sindi@infonet.ee;Stowarzyszenie Polskie w Narvie
jankajaki@wp.pl;Towarzystwo Estonia - Polska
sindi@infonet.ee ;Towarzystwo Kultury Polskiej "Polonia” w Tallinie
bilska@wp.pl;Zwi¹zek Narodowy Polaków "Jutrzenka"
bilska@wp.pl;Zwi¹zek Narodowy Polaków w Estonii w Tallinie
polonia@polonia.ee;Zwi¹zek Polaków w Estonii "Polonia”
bilska@wp.pl;Zwi¹zek Polaków w Kohtla-Järve
misje@scj.pl;Zgromadzenie Ksiê¿y Najœwiêtszego Serca Jezusowego (Sercanie) na Filipinach
zpolskie@polonia-finlandia.fi;"Kontakt” Biuletyn
misje@scj.pl;Zgromadzenie Ksiê¿y Najœwiêtszego Serca Jezusowego (Sercanie) w Finlandii
zpolskie@polonia-finlandia.fi;Zjednoczenie Polskie w Helsingforsie
liitto@suomi-puola.fi;Zwi¹zek Towarzystw Finlandia - Polska
km@zaluski.de;"Echo Polonii"
vkat@club-internet.fr;"G³os Katolicki”
pmk.laferte@free.fr;Archiwum Polskiej Misji Katolickiej w La Ferté sous Jouarre
malanicz.basia32@gmial.com;Biuletyn Federacji Polskich Organizacji Medycznych na ObczyŸnie
info@pumamedia.com.au;Biuletyn Stowarzyszenia Polskich Kombatantów
info@florekentretainment.org;Chór Polski "Piast"
pap@pap.pl;Cmentarz Les Champeaux w Montmorency
braspol@braspol.org.br;Dom Pielgrzyma Polskiej Misji Katolickiej "Bellevue" w Lourdes
contact@maisondelapolonia.com;Dom Polonii (Maison de la Polonia) w Liévin
pmk.laferte@free.fr;Dom Polskiej Misji Katolickiej  im. Anny i Stanis³awa Koz³owskich
mshcorse@yahoo.fr;Dom Polskiej Misji Katolickiej  œw. Jacka na Korsyce
bogdan3122@gmail.com;Dom œw. Kazimierza w Pary¿u
liszuster@hotmail.com;Federacja Polonii Francuskiej
chjbod@med-rz.uni-sb.de;Federacja Polonijnych Organizacji Medycznych
info@florekentertainment.org;Florek & Entertainment
spalugo@uni.lodz.pl;Francusko-Polskie Stowarzyszenie Kulturalne "Krakowiak”
dompolski32@yandex.ru;Francusko-Polskie Stowarzyszenie Kulturalne "Orze³ Bia³y”
polonia.france@wanadoo.fr ;Francusko-Polskie Stowarzyszenie Kulturalne w Douai
fmp7@poczta.onet.pl;Fundacja M³odej Polonii – Przedstawicielstwo we Francji
pomoc@ckudublin.or;Grupa Pomocy Osobom Uzale¿nionym
kontakt@ccipf.org;Instytut Literacki w Maison Laffitte
irb.judycki@libertysurf.fr.;Instytutu Badan Biograficznych (IRB)
ryszard.kapuscinski@gazetapolska.pl;Klub Gazety Polskiej w Pary¿u
itinfo@fjp2.com;Ko³o Przyjació³ Fundacji Jana Paw³a II w Pary¿u
jp2f@nettuno.it;Ko³o Przyjació³ Fundacji Jana Paw³a II w Vaudricourt
kontakt@ccipf.org;Ksiêgarnia Polska w Pary¿u
lettres-slaves@orange.fr;Lettres Slaves -  Polski Antykwariat w Pary¿u
contact@maisondelapolonia.com;Maison de la Polonia de France – Kongres Polonii Francuskiej
prowincjal@oblaci.pl;Misjonarze Oblaci Maryi Niepokalanej we Francji
cp.zaleski@bplp.fr;Muzeum Adama Mickiewicza w Pary¿u
chateaudemontresor@orange.fr;Muzeum Zamku Montrésor
parafiapl.tuluza@hot.pl;Parafia p.w. œw. Andrzeja w Tuluzie - Centrum Duszpasterstwa Polskiego
paroissepolonaisedeparis@gmail.com;Parafia p.w. Wniebowziêcia Najœwiêtszej Maryi Panny w Pary¿u
werchowskamarieclaude@gmail.com;Polonijne Harcerstwo Katolickie (Scouts Polonais Paris Collegium Nobilium) we Francji
ihpan@ihpan.edu.pl;Polska Akademia Nauk Stacja Naukowa w Pary¿u
ccifp@ccifp.pl;Polska Izba Handlowo-Przemys³owa we Francji
pmk.france@gmail.com;Polska Misja Katolicka we Francji
arfp@free.fr;Polski Cmentarz Wojenny w Aubérive
unicef@unicef.pl;
teresa@arszagi.com ;Polski Komitet Towarzystw Miejscowych w Metz
a.p.a.j.t.e.communication@gmail.com;Polskie Stowarzyszenie Autorów, Dziennikarzy i T³umaczy w Europie (APAJTE)
cp.zaleski@bplp.fr;Polskie Towarzystwo Historyczno-Literackie w Pary¿u
acp-3@wanadoo.fr;Polskie Towarzystwo Kulturalne w Pont Sainte Marie
werchowskamarieclaude@gmail.com;Polskie Zgromadzenie Katolickie w Pulversheim
polonia.france@wanadoo.fr ;Polskie Zjednoczenie Katolickie we Francji
mail@cosmoville.eu;Polsko-Francuskie stowarzyszenie Cosmopolite Village
jurandjanko@wp.pl;Polsko-Francusko-Niemiecki Kulturalno-Oœwiatowy Zwi¹zek Polaków w Alzacji
irb.judycki@libertysurf.fr.;Radio France Internationale (RFI) Sekcja Polska
sercesempol@gmail.com;Seminarium Polskie w Pary¿u
association.czesc@gmail.com;Stowarzyszenie "Ballada" w Fleurbaix
werchowskamarieclaude@gmail.com;Stowarzyszenie "Concorde" - Przyjaciele Polskiej Misji Katolickiej we Francji
dompolski@wanadoo.fr;Stowarzyszenie "Dom Polski" w Pary¿u
paris.wk.info@msz.gov.pl;Stowarzyszenie "Kultura Polska" w Le Mans
paris.wk.info@msz.gov.pl;Stowarzyszenie "Les Chemins de Pologne"
paris.wk.info@msz.gov.pl;Stowarzyszenie "Mazowsze Saint Dizier”
nazareth.famille@libertysurf.fr;Stowarzyszenie "Nazareth Famille" w Pary¿u
werchowskamarieclaude@gmail.com;Stowarzyszenie "Orze³ Bia³y" w Ablon sur Seine
werchowskamarieclaude@gmail.com;Stowarzyszenie "Pol-Service" w Pary¿u
amitites.francopolonaises@gmail.com;Stowarzyszenie "Polanka" w Lille
polonicum@romandie.com;Stowarzyszenie "Przyjació³ œw. Kazimierza"
apeop@ecole-polonaise.org;Stowarzyszenie "Szko³a Polska w Pary¿u” przy Ambasadzie RP
ag.paris@lot.pologne.net.;Stowarzyszenie Architektów Polskich we Francji (SARPF)
Alicja.TARDY@emse.fr;Stowarzyszenie ASEMKA w Saint-Etienne
sprzedaz@sbp.pl;Stowarzyszenie Biblioteki Polskiej w Pary¿u (SBBP)
association.czesc@gmail.com;Stowarzyszenie By³ych Uczniów Polskiego Liceum w Pary¿u
poczta@renidunaj.pl;Stowarzyszenie By³ych ¯o³nierzy I Dywizji Polskiej we Francji
enfants-de-pologne@sfr.fr;Stowarzyszenie Dzieci Polskie w Le Vesinet
polonica@aixpolonica.net;Stowarzyszenie Francusko-Polskie "Polonica” w Aix en Provence
francepolognecotedopale@gmail.com;Stowarzyszenie Francusko-Polskie na Wybrze¿u Opalowym
werchowskamarieclaude@gmail.com;Stowarzyszenie Francusko-Polskie w Marchiennes
artuse1@wanadoo.fr;Stowarzyszenie Francusko-Polskie w Saint Maur des Fossés
sitpf@wanadoo.fr;Stowarzyszenie In¿ynierów i Techników Polskich we Francji (SITPF)
association.czesc@gmail.com;Stowarzyszenie Kresowian we Francji
werchowskamarieclaude@gmail.com;Stowarzyszenie Kultura i Tradycja w Henin-Beaumont
association.czesc@gmail.com;Stowarzyszenie Kulturalne "Krakowiak" w Noeux les Mines
accp51@live.fr;Stowarzyszenie Kulturalne Szampania - Polska w Reims
werchowskamarieclaude@gmail.com;Stowarzyszenie Kulturalne w Troyes
association.czesc@gmail.com;Stowarzyszenie Lekarzy Polskiego Pochodzenia we Francji
ag.paris@lot.pologne.net.;Stowarzyszenie Litewsko-Polskie w Pary¿u
paris.wk.info@msz.gov.pl;Stowarzyszenie "Millenium 2000" w Lens
materpolonia@voila.fr.;Stowarzyszenie Mater Polonia w Villejuif
association.concorde@sfr.fr;Stowarzyszenie Mê¿ów Katolickich we Francji
werchowskamarieclaude@gmail.com;Stowarzyszenie Nord-Pas-de-Calais - Polska
stow.obroncowkrzyzaparyz@hotmail.fr;Stowarzyszenie Obroñców Krzy¿a we Francji
lespolonaises@gmail.com;Stowarzyszenie Polek we Francji
paris.wk.info@msz.gov.pl;Stowarzyszenie Polonia Sarthe
werchowskamarieclaude@gmail.com;Stowarzyszeniu Polonistów Francuskich SFEP
wkostyrko@iam.pl;Stowarzyszenie Polskich Artystów Muzyków w Pary¿u
info@polish-spk-foundation.org.au;Stowarzyszenie Polskich Kombatantów i Ich Rodzin
poloniawnantes@gmail.com;Stowarzyszenie Polskie w Nantes
werchowskamarieclaude@gmail.com.;Stowarzyszenie Polskie w Saint-Quentin
biuro@polonika.eu;Stowarzyszenie Polsko-Francuskie "Polonika" w Rueil Malmaison
info@aquilablanca.org;Centrum Kultury Polskiej "Orze³ Bia³y"
amitites.francopolonaises@gmail.com;Stowarzyszenie Polsko-Francuskie w Domont
dompolski32@yandex.ru;Stowarzyszenie Polsko-Francuskie w Villeurbanne
ag.paris@lot.pologne.net.;Stowarzyszenie Polsko-Ukraiñskie w Pary¿u
parabole.asso@gmail.com;Stowarzyszenie Pomocy w Integracji Trwa³ej "Parabole"
polonia.france@wanadoo.fr;Stowarzyszenie PrzyjaŸni Francusko-Polskiej "Sur un air de Pologne"
contact@maisondelapolonia.com;Stowarzyszenie PrzyjaŸni Francusko-Polskiej w Dourges
werchowskamarieclaude@gmail.com;Stowarzyszenie PrzyjaŸni Francusko-Polskiej "¯ywa Polska" w Aulnoye-Aymeries
werchowskamarieclaude@gmail.com;Stowarzyszenie Rodzin Polskich i Polsko-Francuskich
science.varsovie-amba@diplomatie.gouv.fr;Stowarzyszenie Studentów i Absolwentów Polskich we Francji (AEP)
amitites.francopolonaises@gmail.com;Stowarzyszenie Wspólnota Polsko-Francuska
hofman.adri@gmail.com;Strona Polonii w Nantes
paryz@orpeg.pl;Szkolny Punkt Konsultacyjny im. Adama Mickiewicza przy Ambasadzie RP w Pary¿u
materpolonia@voila.fr.;Szko³a Podstawowa Mater Polonia w Villejuif
kontakt@szkola-nicea.org;Szko³a polska w Nicei
kontakt@tchr.fr;Towarzystwo Chrystusowe dla Polonii Zagranicznej (Chrystusowcy) we Francji
materpolonia@voila.fr;Towarzystwo Krzewienia Oœwiaty w Nilvange
