editorial@polishdailynews.com;Stowarzyszenie Arabia Felix w Rijad
secretaria@upranet.com.ar;Argentyñsko-Polskie Stowarzyszenie Kulturalne (ACAP) w La Plata
domeyko@bibliotecadomeyko.com.ar;Biblioteka Polska im. Ignacego Domeyki w Buenos Aires
secretaria@upranet.com.ar;Centrum Kulturalne Argentyñsko Polskie w Oberá
secretaria@upranet.com.ar;Centrum Pamiêci Bohaterów Polskich w Argentynie
klubpolek@gmail.com;Klub Polek w Argentynie
unionpolacaenberisso@hotmail.com;Koœció³ p.w. Matki Bo¿ej Czêstochowskiej w Ezpeleta
secretaria@upranet.com.ar;Polska Macierz Szkolna w Argentynie
sekretariat@albertynki.pl;Polski Dom Spokojnej Staroœci im. B³. Jana Paw³a II w Martin Coronado
secretaria@upranet.com.ar;Polski Oœrodek M³odzie¿owy w Argentynie
zgromadzenie@dominikanki-misjonarki.org;Siostry Dominikanki Misjonarki Jezusa i Maryi (Dominikanki Misjonarki) w Argentynie
nowa_polonia@hotmail.com;Stowarzyszenie Nueva Polonia w Cordoba
polaco@gmail.com;Stowarzyszenie Ognisko Polskie w Buenos Aires
eluciw@infovia.com.ar;Stowarzyszenie Polaków w Mar del Plata im. Œw. Maksymiliana Kolbe w Mar del Plata
polonia-technica@att.net??;Stowarzyszenie Polskich In¿ynierów i Techników w Argentynie
spk.argentina@hotmail.com;Stowarzyszenie Polskich Kombatantów w Argentynie
inespola@gmail.com;Stowarzyszenie Polskie "Dom Polski” w Comodoro Rivadavia
glospolski@gmail.com;Stowarzyszenie Polskie w Oberá
koninptwzk@o2.pl;Towarzystwo Polskie w Posadas
polonesasanmartin@gmail.com ;Stowarzyszenie Polskie w San Martin
polonesasanmartin@gmail.com ;Stowarzyszenie Polskie w Santa Fe
bacpolonia@gmail.com;Stowarzyszenie Studentów i Absolwentów Polskich w Argentynie (SSAPA)
glospolski@gmail.com;Towarzystwo Dom Polski w Rosario
glospolski@gmail.com;Towarzystwo Polskie im. Fryderyka Chopina w Rosario
ambbuenos@datamar.com.ar ;Towarzystwo Polskie w Dock Sud
circuito.polaco@gmail.com;Zwi¹zek Polaków w Argentynie (UPRA)
ambbuenos@datamar.com.ar;Zwi¹zek Polaków w Mendoza
naszagazeta@argentina.com;Zwi¹zek Polski im. I. Paderewskiego w Quilmes
spk.argentina@hotmail.com;Zwi¹zek Polskich Kombatantów w Argentynie
polonia@r.am ;"Póki my ¿yjemy”
dompolskiy@gmail.com;"Wspó³praca Ormiañsko-Polska"
dompolski2013@interia.pl;Wspó³praca Polaków "Dom Polski"
polonia-technica@att.net??;Zwi¹zek Polaków w Armenii "Polonia”
library@polonia.org.au;"Biuletyn Polonii"
marta@artandpsyche.com.pl;"Ekspress Wieczorny"
szlos@doctors.org.uk;"Kraj” Niezale¿ny Magazyn Polski w Brisbane
plcouncilact@gmail.com;"Kronika Polonii”
info@polish-spk-foundation.org.au;"Okólnik"
club@polonia.org.au;"Polonia” – Stowarzyszenie Polaków w Queensland
schrProv@tchr.org;"Przegl¹d Katolicki”
info@tvpolonia.com.au;"Puma Media" Polska Telewizja w Australii i Nowej Zelandii
polishweek@optusnet.com.au;"Tygodnik Polski”
amarczak2@bigpond.com;Audycja chrzeœcijañska 89.3 FM
jglac@optusnet.com.au;Australian Polish Historical Society Inc.
fiszman@bigpond.net.au ;Australian Society of Polish Jews and Their Descendants
eureka5@gmail.com;Australijski Instytut Badañ Miêdzynarodowych
mwarzel@bigpond.net.au;Australijski Instytut Spraw Polskich
info@acci.asn.au;Australijsko-Polska Izba Przemys³owo Handlowa
gklim@pcug.org.au;Biuro Informacyjne Polonii Australijskiej
dompolskicentre@gmail.com;Centralny Dom Polski w Adelaide
lutnia-chorzow@lutnia.com.pl;Chór Lutnia
dmk@muzeum.torun.pl;Dom Kopernika
sekretariatzpm@hotmail.com;Dom Millennium
president@polishclubrowville.org.au;Dom Polski "Syrena” w Rowville
dompolskicentre@gmail.com;Dom Polski im. Jana Paw³a II w Ardeer
skippyziggy@hotmail.com;Dom Polski im. Kopernika w Ballarat
polish.association.hobart@gmail.com;Dom Polski im. Piotra Po³acika
whiteeagle1@bigpond.com;Dom Polski Or³a Bia³ego w Geelong
tcitizenship@polaron.com.au;Dom Polski w Ashfield
sekretariatzpm@hotmail.com;Dom Polski w Bell Post Hill
rainbow1@iinet.net.au;Dom Polski w Maylands
info@mkproject.org.uk;Dom Polski w Milton
president@polishassociationnewcastle.org.au;Dom Polski w Newcastle
president@polishassociationnewcastle.org.au;Dom Polski w Newcastle
schrprov@bigpond.com;Dom Polski w Wollongong
whiteeagleclub.act@gmail.com;Dom Polski White Eagle w Cabramatta
polish.association.hobart@gmail.com;Dom Polskiego Emeryta im. Brata Alberta w Marayong
info@eurosky.com.au;EuroSkyMedia Polska Telewizja w Australii
reception@polishfederation.org.au;Federacja Organizacji Polskich w Po³udniowej Australii
jerzy1@optusnet.com.au;Federacja Polskich Organizacji w Nowej Po³udniowej Walii
charitabletrusts@eqt.com.au.;Fundacja im. Stanis³awa Bluma
australia@kresy-siberia.org;Fundacja Kresy-Syberia Oddzia³ w Australii
kronikapolonii@hotmail.com;Fundacja Kulturalna im. Zofii Sêk-Sêkalskiej w Canberze
marianjanczak@yahoo.com.au;Fundacja Polska w Nowej Po³udniowej Walii
biuro@polska-azja.pl;Fundacja Studiów Polskich
plcouncilact@gmail.com;Fundusz im. Profesora J. Wilczyñskiego
tom_czarnota@hotmail.com;Fundusz Polonii w Queensland
hszunejko@bigpond.com;Gospodarze Pola Kopernika (Polish Youth Association)
jolantahowe@bigpond.com;Grupa Kabaretowo-Teatralna "Vis a vis"
president@polonia.org.au;Internetowy Portal Polonii w Queensland
ryszard.kapuscinski@gazetapolska.pl;Klub Gazety Polskiej - Melbourne
info@klubgpsydney.com;Klub Gazety Polskiej - Sydney
ryszard.kapuscinski@gazetapolska.pl;Klub Gazety Polskiej - Sydney II
panboss@hotmail.com;Klub Karpatczyków w Hobart
whiteeagleclub.act@gmail.com;Klub Or³a Bia³ego w Turner ACT
albionpolclub@gmail.com?;Klub pi³ki no¿nej "Western Eagles SC" (dawniej "KS Polonia")
office@cracoviaclub.com.au;Klub Polski "Cracovia" w Beechboro
office@cracoviaclub.com.au;Klub Polski "Cracovia”
info@polishclubsikorski.com;Klub Polski im. gen. Sikorskiego
polishclubltd@optusnet.com.au;Klub Polski w Ashfield
bankstownpolishclub@bigpond.com;Klub Polski w Bankstown
polish.association.hobart@gmail.com;Klub Polski w Hobart
zsotargowisko@op.pl;Klub Polskiej M³odzie¿y "Iskra”
polish.association.hobart@gmail.com;Klub Seniora Clovelly Park
polish.association.hobart@gmail.com;Klub Seniora Kombatant w Adelaide
sekretariatzpm@hotmail.com;Klub Seniora Millennium w Enfield
school@polishschool.org.au;Klub Seniora przy Domu Kopernika w Grand Junction
polish.association.hobart@gmail.com.;Klub Seniora przy Klubie im. Gen. W³adys³awa Sikorskiego
polish.association.hobart@gmail.com;Klub Seniorów w Hobart
biuro@kslechia.pl;Klub Siatkówki "Lechia"
marianjanczak@yahoo.com.au;Ko³o Akademików Polskich w Nowej Po³udniowej Walii
barbarak@hht.net.au;Ko³o Akademików Polskich w Sydney
info@polish-spk-foundation.org.au;Ko³o Armii Krajowej w Lakemba NSW
info@polish-spk-foundation.org.au;Ko³o By³ych ¯o³nierzy Armii Krajowej w Perth
reception@polishfederation.org.au;Ko³o Polek w Adelaide
iglinski@optusnet.com.au;Ko³o Polek w Ashfield
dompolskicentre@gmail.com;Centralny Dom Polski w Adelaide
iglinski@optusnet.com.au;Ko³o Polek w Cabramatta
iglinski@optusnet.com.au;Ko³o Polek w Canberze
secretary@polishassociationnewcastle.org.au;Ko³o Polek w Newcastle
hszunejko@bigpond.com;Komisja Oœwiatowa Polonii Australijskiej (KOPA)
mtkosciuszko@wp.pl;Mount Koœciuszko Inc
everth@netspace.net.au;Muzeum i Archiwum Polonii Australijskiej (MAPA)
irena@sosnowski.com.au;Muzeum Polskie w Hill River w Po³udniowej Australii
azimuth@mail.com;Oœrodek Polski im. Jana Paw³a II w Ardeer
executive@pccv.org.au;OzPol Community Care Association Inc.
perthidni@yahoo.com.au;Perthidni - Perth Polish Parents&Party Group
reception@polishfederation.org.au;Pierwszy Klub Seniora w Australii Zachodniej
jkortynski@hotmail.com;Polish Australian Fencing Club
referrals@pawacc.org.au;Polish Australian Welfare Association (PAWA)
andrew.siedlecki@mq.edu.au;Polish Studies at Macquarie Uniwersity - Sydney
polishwelfare_hobart@bigpond.com.au;Polish Welfare Office
jglac@optusnet.com.au;Polska Fundacja Artystyczna
jjmccool1@hotmail.com;Polska Grupa Motocyklowa "Bracia ¯elaznego Or³a"
pih@pih.org.pl;Polska Izba Handlowa
polisheducsociety@hotmail.com;Polska Macierz Szkolna Po³udniowej  Australii
macierz@polisheducation.org.au;Polska Macierz Szkolna w Nowej Po³udniowej Walii
marysia.nowak@bigpond.com;Polska Macierz Szkolna w Zachodniej Australii
slowik@optusnet.com.au;Polska Misja Katolicka w Australii
zsorudnik@wp.pl?;Polska Szko³a im. Arcybiskupa Józefa Gawliny
polish.school.albion@tpg.com.au;Polska Szko³a Przedmiotów Ojczystych w Phillip
northshore@polisheducation.org.au;Polska Szko³a Sobotnia Dzielnic Pó³nocnych
marysia.nowak@bigpond.com;Polska Szko³a Sobotnia im. Adama Mickiewicza w Perth
contact@polska-szkola.com.au;Polska Szko³a Sobotnia im. Marii Konopnickiej w Essendon
polish.school.albion@tpg.com.au;Polska Szko³a Sobotnia im. Miko³aja Kopernika w St. Albans
polish.school.albion@tpg.com.au;Polska Szko³a Sobotnia Podstawowa i Œrednia im. Jana Paw³a II w Albion
magda.miotlinska@gmail.com;Polska Szko³a Sobotnia w Ashfield
pwskleks@gmail.com;Polska Szko³a Sobotnia w Bankstown
contact@polska-szkola.com.au;Polska Szko³a Sobotnia w Bowen Hills im. Kasjana Wolaka
marayong@polisheducation.org.au;Polska Szko³a Sobotnia w Marayong
szkola@nepco.org.uk;Polska Szko³a Sobotnia w Newcastle
polishschoolliverpool@gmail.com;Polska Szko³a w Liverpool
school@polishschool.org.au;Polska Szko³a w Randwick
school@polishschool.org.au;Polska Szko³a w Sydney
kurierzachodni@kurier.iinet.net.au;PolskaAustralia.com - Portal internetowy
skippyziggy@hotmail.com;Polski Centralny Oœrodek Sportowo-Rekreacyjny w Albion
wwhorky@gmail.com;Polski Instytut Historyczny w Weston
kronikapolonii@hotmail.com;Polski Klub "Orze³ Bia³y" w Canberze
polish.association.hobart@gmail.com;Polski Klub Seniora Astry w St. Kilda
polishschoolcanberra@gmail.com;Polski Klub Seniora w Australijskim terytorium Sto³ecznym
iglinski@optusnet.com.au;Polski Klub Seniora w Cabramatta
polish.association.hobart@gmail.com;Polski Klub Seniora w Caufield
polish.association.hobart@gmail.com;Polski Klub Seniora w Footscray
polish.association.hobart@gmail.com;Polski Klub Seniora w Frankston
bankstownpolishclub@bigpond.com;Polski Klub Seniora w Geelong
association.hobart@gmail.com.;Polski Klub Seniora w Glenroy
association.hobart@gmail.com;Polski Klub Seniora w Melbourne
association.hobart@gmail.com.;Polski Klub Seniora w Reservoir
iglinski@optusnet.com.au;Polski Klub Seniora w Rowville
polish.association.hobart@gmail.com;Polski Klub Seniora w Werribee
polana@email.com;Polski Oœrodek M³odzie¿owy "Polana"
blacek@optusnet.com.au;Polski Zwi¹zek Kulturalny w Nowej Po³udniowej Walii
blacek@optusnet.com.au;Polski Zwi¹zek Kulturalny w Nowej Po³udniowej Walii
henryk62@iinet.net.au ;Polskie Centrum Katolickie im. Jana Paw³a II w Narrabundah
panboss@hotmail.com;Polskie radio 7 The FM 92.1&96.1 MHz
radio@kurier.iinet.net.au;Polskie Radio Kurier (na 6 EBA FM 95.3)
contact@newsmag.com;Polskie Radio Sydney (radio internetowe)
info@poloniaillinois.com;Polskie Towarzystwo Historyczne w Australii
biuro@australink.pl;Polskie Towarzystwo Kulturalne w Australii Po³udniowej
jglac@optusnet.com.au;Polskie Towarzystwo Kulturalne w Nowej Po³udniowej Walii
jolantahowe@bigpond.com;Polskie Towarzystwo Muzyczne im. F. Chopina
info@acci.asn.au;Polsko-Australijska Izba Przemys³owo Handlowa
radio@kurier.iinet.net.au;Polsko-Australijskie Towarzystwo Kulturalne
ewa.kwiecinska@interia.eu;Polsko-Australijskie Towarzystwo Pomocy Dzieciom Uzdolnionym
radio@kurier.iinet.net.au;Polsko-Australijskie Towarzystwo w Australii Zachodniej
biuro@australink.pl;Portal internetowy Australink
redakcja@pulspolonii.com.;Portal internetowy Puls Polonii
izabella.zielinska@powiernictwo.com;Rada Koordynacyjna Polskich Organizacji w Zachodniej Australii
president@polishcouncil.org.au;Rada Naczelna Polonii Australijskiej i Nowozelandzkiej
jglac@optusnet.com.au;Rada Organizacji Polskich na Australijskie Terytorium Sto³eczne
marta.kiec-gubala@msz.gov.pl;Radio 2NUR FM 103.7 MHz
info@4eb.org.au;Radio 4EB FM 98.1 MHz
ebiradio@5ebi.com.au;Radio 5EBI FM 103.1 MHz
biuro@australink.pl;Radio Adelaide FM 101.5 MHz
info@coastfm.com.au;Radio Coast FM 88.5 MHz
radio@glosnadziei.pl;Radio G³os Nadziei
manager@6eba.com.au;Radio G³os Polonii
pbafm@pbafm.org.au;Radio Polonia PBA FM 89.7 MHz
office@favoryta.com;Sekcja Polska Radia SBS
contact@polska-szkola.com.au;Sobotnia Szko³a Polska w Capalabie
reception@polishfederation.org.au;Spo³eczny Fundusz Kulturalny w Po³udniowej Australii
reception@polishfederation.org.au;Stowarzyszenie Absolwentów i Studentów Polskich
czarnot@www.nsw.gov.au;Stowarzyszenie Australijskich Polaków "Auspol"
reception@polishfederation.org.au;Stowarzyszenie Górali Polskich w Po³udniowej Australii
info@polish-spk-foundation.org.au;Stowarzyszenie Lotników Polskich w Wiktorii
nasza_polonia@yahoo.com;Stowarzyszenie Nasza Polonia
school@polishschool.org.au;Stowarzyszenie Polaków w Ballart
admin@ocva.org.uk;Stowarzyszenie Polaków w Bunbury
whiteeagle1@bigpond.com;Stowarzyszenie Polaków w Geelong
skippyziggy@hotmail.com;Stowarzyszenie Polaków w Glenroy
president@polonia.org.au;Stowarzyszenie Polaków w Quensland "Polonia”
iglinski@optusnet.com.au;Stowarzyszenie Polaków w Townsville
iglinski@optusnet.com.au;Stowarzyszenie Polaków Wschodnich Dzielnic Melbourne
miriam@australianpolish.org;Stowarzyszenie Polek w Nowej Po³udniowej Walii
	info@polish-spk-foundation.org.au;Stowarzyszenie Polskich Kombatantów w Australii
sppa.sekretarz@gmail.com;Stowarzyszenie Polskich Profesjonalistów w Australii
fedpolsa@polishfederation.org.au;Stowarzyszenie Polskie na Terytorium Pó³nocnym
joanna@new.co.za;Stowarzyszenie Techników Polskich w New Town
reception@polishfederation.org.au;Szko³a Polska im. Tadeusza Koœciuszki w Morphett Vale
suru@teatrfantazja.org;Teatr Fantazja w Roselands
maw4@hotmail.com;Teatr Ottoway w Athol Park SA
mro38@optusnet.com.au;Teatr Prób Miniatura im. Jerzego Szaniawskiego
smikolajski@hotmail.com;Teatr Scena`98
office@qjfpl.org;The Queen Jadwiga Foundation
music@sydneyconsort.com.au;The Sydney Consort (Zespó³ muzyki dawnej)
polishweek@optusnet.com.au;The Sydney Polish Lanquaqe Meetup Group
SChrProv@tchr.org;Towarzystwo Chrystusowe dla Polonii Zagranicznej w Australii
info@chopin.pl ;Towarzystwo im. Fryderyka Chopina w Wiktorii
kronikapolonii@hotmail.com;Towarzystwo Sztuk Piêknych w Canberze
pl2000fm@yahoo.com;Twoje Radio 2000 FM98.5 MHz
jp2sydney@hotmail.com;Zespó³ Muzyczny im. Jana Paw³a II
wieslaw@arach.net.au;Zespó³ Piesni i Tañca Kuku³eczka
urszula.lang@lajkonik.com.au;Zespó³ Piesni i Tañca Lajkonik
sekretariat@wok-hutnik.pl;Zespó³ Piesni i Tañca Oberek
daniel@podhale.org.au;Zespó³ Piesni i Tañca Podhale
martyna.anna.kalkowska@gmail.com;Zespó³ Piesni i Tañca Wielkopolska
whiteeagle1@bigpond.com;Zespó³ Pieœni i Tañca Krakowiak
jola@kujawysydney.com;Zespó³ Pieœni i Tañca Kujawy
info@lowiczmelbourne.org.au;Zespó³ Pieœni i Tañca £owicz
bczech@optusnet.com.au;Zespó³ Pieœni i Tañca Polonez
info@polonez.org.au;Zespó³ Pieœni i Tañca Promyk
misjonarki@mchr.pl;Zgromadzenie Sióstr Misjonarek Chrystusa Króla dla Polonii Zagranicznej (Misjonarki Chrystusa Króla) w Australii
info@polish-spk-foundation.org.au;Zjednoczenie Kó³ Polek w Australii
canberra.amb.sekretariat@msz.gov.au;Zwi¹zek Dziennikarzy R.P – Syndykat Australia
info@polish-spk-foundation.org.au;Zwi¹zek Harcerstwa Polskiego w Australii
liebknecht-gymnasium@web.de;Zwi¹zek Nauczycieli Jêzyka Polskiego
iglinski@optusnet.com.au;Zwi¹zek Polaków w Ashfield
	ServiceCentre@education.tas.gov.au;Zwi¹zek Polaków w Hobart
rada@polish.org.au;Zwi¹zek Polski w Nowej Po³udniowej Walii
wawel.wollongong@gmail.com;Zwi¹zek Polski w Wollongong
biuro@kombatantpolski.pl;Zwi¹zek Polskich WiêŸniów Politycznych
ambpol@clover.com.au;Zwi¹zek Wolnych Polaków w Australii Solidarnoœæ
office@austriapol.com;"Austriapol" Magazyn Dialogu Miedzykulturowego (Portal internetowy)
redakcja.elipsa@op.pl;"Elipsa.at"  Internetowy serwis informacyjny
office@polonia-nova.com;"I love Polen" Oficjalna strona internetowa austriackiej Polonii
kpi@chello.at;"Jupiter" Magazyn Kulturalno-Informacyjny
polnischekirchewien@gmail.com;"Nasza Wspólnota”
polonika@chello.at;"Polonika”
office@polonia-nova.com;"¯ongler Polonia Nova" Magazyn Polsko-Austriacki
info@polonez.at ;Austriacko-Polskie Stowarzyszenie dla Popierania Sztuki i Czasu Wolnego "Polonez”
office@ipolen.at;Austriacko-Polskie Stowarzyszenie Kulturalno-Informacyjne "ipolen"
office@viennapan.org;Biblioteka Polskiej Akademii Nauk - Stacji Naukowej w Wiedniu
ce@cameratapolonia.at;"Camerata Polonia" 
info@ibz-polonia.eu;Centrum Informacyjo-Doradcze IBZ Polonia (Polonia - Informations- und Beratungszentrum)
office@polonia-nova.com;Centrum Kulturalne "I love Polen"
sitpf@wandoo.fr;Europejska Federacja Polonijnych Stowarzyszeñ Naukowo-Technicznych (SITPF)
office@forumpolonii.at;Forum Polonii w Austrii (Wspólnota Polskich Organizacji w Austrii)
office@ipolen.at;iPolen.at – Forum i Portal Polonii w Austrii
'kabaret@kabaret-e.at;';Kabaret "E"
info@magnat.at;Klub "Polski Klub” w Austrii
KlubGP.Wieden@gmail.com;Klub Gazety Polskiej - Wiedeñ
kgp_wieden_2@hotmail.com;Klub Gazety Polskiej - Wiedeñ II
jupiter.red@chello.at;Klub Inteligecji Polskiej w Wiedniu
office@viennapan.org;Klub Profesorów przy Polskiej Akademii Nauk – Stacji Naukowej w Wiedniu
klub.sobieski@aon.at ;Klub Sobieski (Polnisch-Österreichischer Kultur- und Freizeitverein in Kärnten)
ipw@magnet.at;Klub Studentów Polskich "Plus”
kpi@chello.at;Kongres Polonii w Austrii
ce@cameratapolonia.at;Pierwsza Spo³eczna Szko³a Polska w Austrii
polnischekirchewien@gmail.com;Polska Misja Katolicka w Austrii
polnischekirchewien@gmail.com;Polska Parafia Podwy¿szenia Krzy¿a Œwiêtego (Zmartwychwstañcy)
wien@pot.gov.pl;Polski Oœrodek Informacji Turystycznej w Austrii
sekretariat@sutw.pl;Polski Uniwersytet Trzeciego Wieku w Austrii
szkola@uczymypolskiego.at;Polskie Stowarzyszenie Kulturalno-Oœwiatowe w Austrii
office@forumpolonii.at;Polskie Towarzystwo Gimnastyczne "Sokó³ Polski” w Austrii
kjm@aon.at;Polskie Towarzystwo Medyczne w Austrii
dyrektor@szkolapolska.org;Polskie Towarzystwo Sportowe w Austrii
ipw@magnet.at;Polsko-Austriacki Klub Informacji i Kultury "Sierpieñ 80”
kontakt@polonia-salzburg.com;Polsko-Austriackie Stowarzyszenie "Salzburg”
redakcja.elipsa@op.pl;Polsko-Austriackie Stowarzyszenie Informacyjno Integracyjne "Elipsa.at"
office@taktkultur.at;Polsko-Austriackie Towarzystwo Kulturalne "Takt"
piotrradowski@gmx.at;Rada Koordynacyjna Polskich Organizacji Niepodleg³oœciowych w Austrii
post@ma07.wien.gv.at;Sobieski.at Förderverein für alternative Kunst und Kultur
office@viennapan.org;Stacja Naukowa Polskiej Akademii Nauk w Wiedniu
polster.wien@gmail.com;Stowarzyszenie Kulturalne "Pol-Ster"
polonia.tirol@ikbnet.at;Stowarzyszenie Polonii w Tyrolu
office.vpi@vpivienna.org;Stowarzyszenie Polskich In¿ynierów i Techników w Austrii
polnischekirchewien@gmail.com;Stowarzyszenie Polskich Rodzin Katolickich w Austrii (SPRKwA)
piotrradowski@gmx.at;Stowarzyszenie Polskiej Kultury (SPK) w Austrii
office@pomoc.or.at;Stowarzyszenie "Pomoc"- Porady i œwiadczenia od A do Z
piotrradowski@gmx.at;Stowarzyszenie Studentów Polskich w Austrii "Impuls"
ipw@magnet.at;Towarzystwo Lekarzy Polskich w Austrii
info@wiener-krakauer.at;Wiedeñsko-Krakowskie Towarzystwo Kulturalne
office@poloniaoberoesterreich.com;Wspólnota Polaków w Górnej Austrii
misje@scj.pl;Zgromadzenie Ksiê¿y Najœwiêtszego Serca Jezusowego (Sercanie) w Austrii
biuro@zwiazek-podhalan.com;Zwi¹zek Podhalan "Zakopane"
strzecha@chello.at;Zwi¹zek Polaków w Austrii "Strzecha”
polonialinz@aon.at;Zwi¹zek Polaków w Górnej Austrii
bakslavuniver@hotmail.com;Centrum Jêzyka i Kultury Polskiej (CJKP) na Bakiñskim Uniwersytecie S³owiañskim
azerpolonia@op.pl;Polonia Azerbejd¿an Wspólnota Polska
azerpolonia@op.pl;Rzymskokatolickie Towarzystwo Dobroczynnoœci i Katolicka Wspólnota Polska w Baku
biuro@sekretariat-misyjny.pl;Stowarzyszenie Apostolstwa Katolickiego (Pallotyni) na Barbados
antwerpiapopolsku@gmail.com;"Antwerpia po polsku"
info@antwerpiapolska.be;"Antwerpia Polska" Portal polonijny
info@gazetka.be;"Gazetka"
LeokadiaK@yahoo.fr;"Listy z daleka”
pmkbruksela@gmail.com;"Nasza Wspólnota” Biuletyn Polskiej Misji Katolickiej
'info@nowinki.pl
';"Nowinki"
murbanska@hotmail.com;"Polak w Belgii” Biuletyn
info@polonia.be;"Polonia.be" Portal Polonii Belgijskiej
redakcja@poloniabelgijska.be;"PoloniaBelgijska.be" Niezale¿ny Portal Polonijny
nordica@telenet.be;"PoloniaNet"
ptaszynski.translations@skynet.be;Belgijski Zwi¹zek Kombatantów
info@bepolux.be;Bepolux – Belgijsko-Luksembursko-Polska Izba Handlowa
bibl.pl.bxl@gmail.com;Biblioteka Polska w Brukseli
zbigniew.opyd@gmail.com.;Biblioteka przy Polskiej Misji Katolickiej w Brukseli
dorota_dobrzynska@hotmail.com;Bractwo ¯ywego Ró¿añca w Antwerpii
architektura@bekap.be.;Brukselski Klub Polek
limosa@eranova.fgov.be;'Centrum Badañ Historycznych im. J. Lelewela (Centre International Lelewel d''études et d''informations historiques)'
balcerzakl@belgacom.net;Centrum Edukacji i Kultury Polskiej "MaGaDom" w Brukseli
centrumpolskie@gmail.com;Centrum Polskie im. Ignacego Jana Paderewskiego w Brukseli
centrumantwarpia@gmail.com;Centrum Pomocy Prawnej i ¯yciowej dla Polonii
postviadrina@postviadrina.be;Centrum Wschodnioeuropejskie "Post Viadrina" w Gandawie
info@bekap.be;Chrzeœcijañskie Zjednoczenie Polaków  w Brukselia
info@centrumpolskie.com;Dom Polski "Millenium” w Heusden-Zolder
info@centrumpolskie.com;Dom Polski "Polonez" w Beringen
bruksela@ewspa.edu.pl;Dom Polski w Brukseli
dom_polski1@op.pl;Dom Polskiego Zwi¹zku Kulturalnego w Genk
fo@fundacjapoloniainternational.org;Fundacja Polonia International
dorota_dobrzynska@hotmail.com;Instytut Badañ Polonijnych w Okrêgu Centre
zarzad@ksm.lublin.pl;Katolickie Stowarzyszenie M³odzie¿y Polskiej
ptaszynski.translations@skynet.be;Ko³o Belgijsko-Polskie w Retinne
dorota_dobrzynska@hotmail.com;Ko³o Belgijsko-Polskie w Willebroek
bvpo1978@gmail.com;Ko³o By³ych ¯o³nierzy Armii Krajowej w Belgii
ptaszynski.translations@skynet.be;Ko³o Kulturalne Belgijsko-Polskie w La Louvi?re
ptaszynski.translations@skynet.be;Ko³o Kulturalne Belgijsko-Polskie Regionu Centrum
ccbelpol@skynet.be;Ko³o Kulturalne Belgijsko-Polskie w Charleroi
info@network-pl.org;Ko³o M³odzie¿y Polskiej przy Parafii Rzymsko-Katolickiej w Antwerpii
nakaszuby@gmail.com;Ko³o Przyjació³ Polskiego Lotnictwa
virtualiaart@gmail.com;Miedzynarodowe Stowarzyszenie Artystów Autorów Dziennikarzy Prawników Virtualia ART
info@nowinki.be;Nowinki VZW
bvpo1978@hotmail.com;Ogólnoœwiatowy Korespondencyjny Klub Emigrantów
info@network-pl.org;Oœrodek Polsko-Katolicki w Marcinelle
info@network-pl.org;Polish Expat Network Belgium
info@jasnawoda.be;Polonijny Zespó³ Folklorystyczny "Krakus" w Genk
nfo@pmsz.be;Polska Macierz Szkolna w Belgii
misja@pmkbruksela.com;Polska Misja Katolicka w Antwerpii
zbigniew.opyd@gmail.com;Polska Misja Katolicka w Brugge
pmkbruksela@gmail.com;Polska Misja Katolicka w Brukseli (Rue Jourdan)
zbigniew.opyd@gmail.com;Polska Misja Katolicka p.w. œw. Maksymiliana Marii Kolbego w Centre-Ressaix
kaszyca-jerzy@wp.pl,;Polska Misja Katolicka w Genk
zbigniew.opyd@gmail.com;Polska Misja Katolicka w Leopoldsburg
zbigniew.opyd@gmail.com;Polska Misja Katolicka w Li?ge
zbigniew.opyd@gmail.com;Polska Misja Katolicka w Maasmechelen
info@Polonia.be;Polska Misja Katolicka w Namur
spk.antwerpia@gmail.com;Polski Cmentarz Wojskowy w Lommel
info@centrumpolskie.be;Polski Dom Kultury im. M. Kopernika w Genk-Zwartberg
admin@polska-azja.pl;Polski Instytut Nauki i Kultury
olimpijski@pkol.pl;Polski Komitet Olimpijski w Belgii
pot@pot.gov.pl;Polski Oœrodek Informacji Turystycznej w Belgii
ptaszynski.translations@skynet.be;Polski Oœrodek Kulturalno-Oœwiatowy Okrêg Mons
ogui2004@yahoo.fr;Polski Oœrodek Wakacyjny "Millennium" (Centrum Wakacyjnym Polskiej Macierzy Szkolnej) w Comblain-la-Tour
polambbod@skynet.be;Polski Zwi¹zek Kulturalny w Genk
ladomirscy-bxl@wp.pl;Polsko-Belgijskie Stowarzyszenie T³umaczy I Filologów
dorota_dobrzynska@hotmail.com;Poolse  Gemeenschap Polonia VZW
ptaszynski.translations@skynet.be;Rada Imigracyjna w Amay - Sekcja Polska
rada.polonii@polonia.be;Rada Polonii Belgijskiej
leszeg@yahoo.fr;Radio Ró¿a BXL
m.wojciechowski@dominicains.be;Sekcja Polska Katolickiego Centrum Europejskiego w Brukseli
iduboisdaische@yahoo.fr;Stowarzyszenie In¿ynierów i Ekonomistów Polskich w Belgii
balcerzakl@belgacom.net;Stowarzyszenie Lekarzy Polskich w Belgii
hannadrzewiecka@gmail.com;Stowarzyszenie Mê¿ów Katolickich w Belgii
Polonii@polonia.be;Stowarzyszenie Polonii Belgijskiej (S.P.B)
info@Polonia.be;Stowarzyszenie Polskich Kombatantów w Belgii
hannadrzewiecka@gmail.com;Stowarzyszenie Polskich Kombatantów w Belgii - Ko³o Beringen
iduboisdaische@yahoo.fr;Stowarzyszenie Polskiech Kombatantów w Belgii - Oddzia³ Mons
poltorkg@ca.inter.net;Stowarzyszenie Polskich Studentów przy Uniwersytecie w Waterloo
tosta@komiksfestiwal.com;Stowarzyszenie Walonia Polska
sekretariat@szkolapmk.pl;Szkolny Punkt Konsultacyjny im. Jana Paw³a II przy Polskiej Misji Katolickiej na Schaerbeek w Brukseli
spk.antwerpia@gmail.com;Szkolny Punkt Konsultacyjny im. Gen. St. Maczka przy Ambasadzie RP w Brukseli z siedzib¹ w Antwerpii
sekretariat@szkola-lelewela;Szkolny Punkt Konsultacyjny im. Joachima Lelewela przy ambasadzie RP w  Brukseli
