info@pava-swap.org;Towarzystwo Opieki nad Polskimi Zabytkami i Grobami Historycznymi we Francji
ewale@kul.lublin.pl;Towarzystwo Przyjació³ S³ownika Biograficznego Polonii Œwiata
cfp.secretariat@gmail.com;Wspólnota Francusko-Polska
kalina@awf.wroc.pl;Zespó³ Pieœni i Tañca "Kalina"
info@polonez.org.au;Zespó³ Pieœni i Tañca "Polonez"
m.karlowska_xl@wp.pl;Zgromadzenie Sióstr Pasterek od Opatrznoœci Bo¿ej we Francji
cssjkrk@rubikon.pl;Zgromadzenie Sióstr Œwiêtego Józefa (Józefitki) we Francji
sercanki@zakon.opoka.org.pl;Zgromadzenie S³u¿ebnic Najœwiêtrzego Serca Jezusowego (Sercanki) we Francji
assosciation.czesc@gmail.com;Zwi¹zek By³ych Kombatantów i Rezerwistów w Troyes
association.concorde@sfr.fr;Zwi¹zek Polskich Stowarzyszeñ Katolickich we Francji
srbp@ap.edu.pl;Zwi¹zek Towarzystw Gimnastycznych "Sokó³” we Francji
ofmcapwawa@gmail.com;Zakon Braci Mniejszych Kapucynów
kurier_atenski@imn.gr;"Kurier Ateñski”
terminowa@gmail.com;Grecko-polski net
giannakakos2260@hotmail.com;Grecko-Polski Zwi¹zek im. Fryderyka Chopina w Lamii
poland@first.gr;Grecko-Polski Zwi¹zek PrzyjaŸni i Wspó³pracy
tkp.ateny@gmail.com;Klub Biznesu "Agora"
tkp.ateny@gmail.com;Klub Polski w Atenach
gosia@hol.gr;Niezale¿ny Zwi¹zek Kobiet Polskich na Emigracji w Atenach
evavanti@yahoo.com;Niezale¿ny Zwi¹zek Polonii Greckiej
Parfia.ateny@gmail.com;Parafia Serca Chrystusa Zbawiciela w Atenach
parafia.ateny@gmail.com ;Polska Misja Katolicka w Grecji
poland@first.gr;Stowarzyszenie Polskich In¿ynierów i Techników w Grecji
marzanna.geisler@gmail.com;Stowarzyszenie Przyjació³ Szko³y Polskiej w Grecji
tkp.ateny@gmail.com;Towarzystwo Kultury Polskiej im. Juliusza S³owackiego w Atenach
sekretariat@atenyzs.pl;Zespó³ Szkó³ przy Ambasadzie RP w Atenach im. Zygmunta Mineyki
misjonarki@mchr.pl;Zgromadzenie Sióstr Misjonarek Chrystusa Króla dla Polonii Zagranicznej (Misjonarki Chrystusa Króla) w Grecji
zrzeszenie.mieszko@wp.pl;Zrzeszenie Polaków w Grecji "Mieszko”
poland@first.gr;Zwi¹zek Nauki i Techniki Polaków w Grecji
info@polonorama.com;Zwi¹zek Polaków na Krecie
zwpolakow@yahoo.gr;Zwi¹zek Polaków Prowincji Dodekanez
evavanti@yahoo.com;Zwi¹zek Polaków w Messinie
tkp.ateny@gmail.com;Zwi¹zek Polaków Zachodniej Grecji i Wysp Joñskich
tkp.ateny@gmail.com;Zwi¹zek Polonijnych Klubów Sportowych "Panpolonikos” w Atenach
agostinho1504@hotmail.com;Centrum Kultury Polskiej "Orze³ Bia³y"
polonia@zpepolonia.ee;Centrum Kultury Polskiej "Polonia" Gruzja-Abchazja
larmaria19@yahoo.com;Klub Polski w Gruzji
kubickaa@yahoo.com;Polska Szko³a Sobotnia im. œw. Królowej Jadwigi
larmaria19@yahoo.com;Stowarzyszenia Polek w Gruzji "PrzyjaŸñ”
larmaria19@yahoo.com;Stowarzyszenie Dom Polski im. Ludwiga M³okosiewicza
larmaria19@yahoo.com;Stowarzyszenie Polaków w Gruzji "Polonia”
polcentrgeo@hotmail.com;Zwi¹zek Kulturalno-Oœwiatowy Polaków w Gruzji "Polonia”
konsulat@konsulatrp.zt.ua;Zwi¹zek Polaków w Abchazji "Wspólnota Polska”
larmaria19@yahoo.com;Zwi¹zek Polaków w Po³udniowej Gruzji
hipokrates@org;Zwi¹zek Polonii Medycznej w Gruzji im. œw. Grigo³a Peradze
info@aguilablanca.org ;"Arrano Zuria" Biuletyn Stowarzyszenia Kulturalnego Baskijsko-Polskiego
redaktion@polonika.at;"Swojskie Strony" Bezp³atny Tygodnik Polaków w Hiszpanii
asociacionpolonica@hotmail.com;Europejskie Stowarzyszenie Studentów "Victoria” w Madrycie
sekretariatforum@gmail.com;Hiszpañsko-Polskie Stowarzyszenie Kulturalne "Forum"
bracelona@tchr.org;Kapelania Polska w Alcala de Henares
'barcelona@tchr.org
';Kapelania Polska w Barcelonie
kp.madryt@kapelania.nazwa.pl;Kapelania Polska w Madrycie
info@patriaefidelis.pl;Ko³o Stowarzyszenia M³odzie¿y Patriotycznej "Patriae Fidelis" w Hiszpanii
info@polishprofessionalsinmadrid.org;Polish Professionals In Madrid
info@polishprofessionalsinmadrid.org;Poloniabarcelona.pl – Polonijna Platforma Internetowa
pilasewicz@hotmail.com;Polonijne Ognisko Szkolne w Madrycie
info@poloniaengalicia.com;Polskie Stowarzyszenie Kulturalne w Galicji
phig@phig.pl;Polsko – Hiszpañska Izba Gospodarcza
redakcja@polonia.es;Portal Polonia.es
info@polish-spk-foundation.org.au;Samodzielne Ko³o Stowarzyszenia Polskich Kombatantów w Madrycie
wiernipolacy@hotmail.com;Serwis "Wierni Polacy"
info@polskaszkola.es;Sobotnia Szko³a Polska im. Jana D³ugosza w Madrycie
sekretariatforum@gmail.com ;Stowarzyszenia Kulturalne Polsko-Aragoñskie
consulado.polonia.malaga@gmail.com;Stowarzyszenie "Dom Polski” w Getafe
casacopernico@hotmail.com;Stowarzyszenie im. Karola Wojty³y w Segovii
catalunya_polonia@yahoo.es;Stowarzyszenie Kulturalne I`Aplec Cultural Polones – Catala w Lloret de Mar
punktbcn@gmail.com;Stowarzyszenie Kulturalne Kataloñsko-Polskie w Barcelonie
sekretariatforum@gmail.com;Stowarzyszenie Kulturalne PrzyjaŸni Polsko-Hiszpañskiej "Kopernik”
acdsparta@gmail.com;Stowarzyszenie Kulturalno Sportowe Polaków w Hiszpanii "Sparta-Alcala”
asociacionpolonica@hotmail.com;Stowarzyszenie Kulturalno-Sportowe "Polonia”
info@klubpolski.ch;Stowarzyszenie Polaków "Klub Polski”
asociacionpolonica@hotmail.com;Stowarzyszenie Polaków w Asturii "Nike”
asociacionpolonica@hotmail.com;Stowarzyszenie Polaków w Hiszpanii "Dom Polski" w Getafe - Madryt
info@klubwawel.org;Stowarzyszenie Polaków w Hiszpanii "Klub Wawel”
info@aguilablanca.org;Stowarzyszenie Polaków w Hiszpanii "Orze³ Bia³y”
casacopernico@hotmail.com;Stowarzyszenie Polaków Zamieszka³ych w Avili "Casa de Copernico”
anna.kielak@naszdom.org;Stowarzyszenie Polskich Lekarzy i Personelu Sanitarnego w Hiszpanii “Polonia Médica”
info@aguilablanca.org;Stowarzyszenie Rodziców Dzieci Mówi¹cych po polsku "Polonica”
info@naszdomaragon.org;Stowarzyszenie Spo³eczno-Kulturowe "Nasz Dom” w Aragon
malapolonia@op.pl;Szko³a "Ma³a Polonia"
kontakt@tchr.fr;Towarzystwo Chrystusowe dla Polonii Zagranicznej w Hiszpanii
bozenapkilanowski@gmail.com;Towarzystwo Przyjació³ Fundacji Jana Paw³a II w Madrycie
poolspodium@gmail.com;"Scena Polska"
info@polonia.nl ;Caritas Polski w Utrechcie
post@topolki.nl;Chór "Malwa"
info@osstoja.nl;Chór "Weso³y Tu³acz"
info@fpsn.nl;Forum Polskich Szkó³ w Holandii
e.rodenburg@stichtingplon.eu;Fundacja "Plon" Polska Platforma Porozumiewawcza w Królestwie Niderlandów
'info@witryna.nl;';Fundacja "Witryna”
info@europolonia.nl;Fundacja Kulturalno-Charytatywna "Euro Polonia"
adviesvoorpolen@gmail.com;Fundacja Niderlandzki Dom Polski
npckerotterdam@gmail.com;Fundacja Niderlandzko-Polskie Centrum Kultury i Edukacji
voorzitter@lokomotywa.nl ;Fundacja Polskie Centrum Edukacji i Kultury "Lokomotywa"
polskaszkolkautrecht@gmail.com;Fundacja Polsko-Niderlandzkie Centrum Edukacji i Integracji
e.rodenburg@stichtingplon.eu;Katolickie Stowarzyszenie Polek w Limburgii
ewastas@yahoo.com;Klub Gazety Polskiej - Amsterdam
info@maczekmuseum.nl;Muzeum Gen. Stanis³awa Maczka w Bredzie
haga.amb.sekretariat@msz.gov.pl;Niderlandzko-Polska Izba Gospodarcza w Hadze
npckerotterdam@gmail.com;Niderlandzko-Polskie Centrum Kultury i Edukacji w Rotterdamie
tkozienski@hotmail.com;Parafia Polska p.w. NMP Czêstochowskiej w Archidiecezji Utrecht
slawekklim@hotmail.com;Parafia Polska p.w. NMP Gwiazdy Morza w Rotterdamie
bmschr@faustyna.nl;Parafia Polska p.w. Œw. Faustyny Kowalskiej w Brabancji i Limburgii
slawekklim@hotmail.com;Parafia Polska p.w. Œw. Maksymiliana Marii Kolbe w Rijsbergen
info@osstoja.nl;Polonijne Stowarzyszenie Kulturalno-Oœwiatowe "Osstoja”
secretariaat@polonia-breda.nl;Polonijny Zespó³ Folklorystyczny "Mazur” w Bredzie
k.obiedzinski@pmkamsterdam.nl;Polska Misja Katolicka "Amsterdam" p.w. Ducha Œwiêtego - Pó³nocna Holandia
jokonek@live.nl;Polska Misja Katolicka w Groningen
npckerotterdam@gmail.com;Polska Szko³a im. H. Sienkiewicza w Rotterdamie
polskaszkolanijmegen@gmail.com;Polska Szko³a im. Ireny Kwiatkowskiej w Nijmegen
slawekklim@hotmail.com;Polska Szko³a Parafialna w Rotterdamie
info@osstoja.nl;Polska Szko³a Sobotnia w Oss
kw11@poczta.onet.pl;Polska Szko³a w Eindhoven
poolseschool@planet.nl;Polska Szko³a w Groningen
info@polskaszkolatilburg.nl;Polska Szko³a w Tilburgu
amsterdam@pot.gov.pl;Polski Oœrodek Informacji Turystycznej w Holandii
pkol@pkol.pl;Polski Komitet Olimpijski w Holandii
secretariaat@ggzkeizersgracht.nl;Polskie Centrum Zdrowia Psychicznego GGZ w Amsterdamie
e.rodenburg@stichtingplon.eu;Polskie Towarzystwo Katolickie (PTK) w Enschede
ambhaga@polamb.nl;Polskie Towarzystwo Katolickie Ko³o Breda
ambhaga@polamb.nl;Polskie Towarzystwo Medyczne w Holandii
hoofdredactie@pnkv.nl;Polsko Niderlandzkie Stowarzyszenie Kulturalne
polskaszkolanijmegen@gmail.com;Stowarzyszenie "Polska Szko³a w Nijmegen"
poolspodium@gmail.com;Stowarzyszenie "Scena Polska” w Utrechcie
info@vereniging-1epoolsepantserdivisie-nederland.nl;Stowarzyszenie 1-szej Polskiej Dywizji Pancernej w Bredzie
ads@ng24.ie;Stowarzyszenie Kulturalne "Polonia” w Bredzie
info@polish-spk-foundation.org.au;Stowarzyszenie Polskich Kombatantów w Holandii
europa@tip.nl;Stowarzyszenie T³umaczy w Veenendaal
psbreda@gmail.com;Szko³a Polska w Bredzie
kierownik@spk-haga.nl;Szko³a Polska w Hadze
hanka@xs4all.nl;Towarzystwa Polek w Holandii "Top"
ambhaga@polamb.nl;Towarzystwo "Jednoœæ" pod opiek¹ Œw. Wojciecha w Heerlen
edmunddruz@yahoo.de;Towarzystwo Chrystusowe dla Polonii Zagranicznej w Holandii
post@topolki.nl;Zespó³ "Cracovia" w Eindhoven
info@polonia.nl ;Zespó³ "Podlasie" w Heerlen
ambhaga@polamb.nl;Zjednoczenie Katolicko-Polskich Towarzystw w Holandii
e.rodenburg@stichtingplon.eu;Zwi¹zek Polaków w Heerlen
consul@surabayapolandconsulate.com;"Polonia w Indonezji"
info@polclub.biz;Polski Klub Biznesu w D¿akarcie
misje@scj.pl;Zgromadzenie Ksiê¿y Najœwiêtszego Serca Jezusowego (Sercanie) w Indonezji
polembas@iol.ie;"Ad Polonia”
redakcja@ambasador.ie;"Ambasador Kulturalny"
ads@ng24.ie;"Nasz G³os"
arturziomek@hotmail.com;ArtPolonia
info@together-razem.org;Centrum Wsparcia i Integracji "Together-Razem”
info@forumpolonia.org;Forum Polonia
hq@mymind.org;Fundacja MyMind
web.content@limerick.ie;Irish-Polish Cultural and Business Association in Limerick
info@irelandpolandchamber.com;Irlandzko-Polska Izba Handlowa
klubgpdublin@gmail.com;Klub Gazety Polskiej - Dublin
klub.waterford@gmail.com;Klub Gazety Polskiej - Waterford
kontakt@plbclub.pl;Polish Business Club
info@szkolapak.com;Polska Akademia Wiedzy (PAK) w Dublinie
polish.peacecorps@gmail.com;Polska Grupa Korpusów Pokoju w Irlandii
spgalway@gmail.com;Polska Szko³a im. Wis³awy Szymborskiej w Galway
spgalway@gmail.com;Polska Szko³a w Ballinasloe
polskaszkolaclonmel@gmail.com;Polska Szko³a w Clonmel
office@polskaszkola.ie;Polska Szko³a w Dublinie Altogether
kontakt@psletterkenny.eu;Polska Szko³a w Letterkenny
sptuam@gmail.com;Polska Szko³a w Tuam
itekjam@interia.pl;Polska Szko³a w Waterford (Szkolny Punkt Konsultacyjny przy Ambasadzie RP w Dublinie z siedzib¹ w Waterford)
posk@poskdublin.org;Polski Oœrodek Spo³eczno-Kulturalny w Dublinie
basis@entemp.ie;Polskie Centrum Informacji i Kultury w Dublinie
witekjam@interia.pl;Polskie Stowarzyszenie Edukacyjne w Waterford
info@mycork.org;Stowarzyszenie  “My Cork”Stowarzyszenie  “My Cork”Stowarzyszenie  “My Cork”Stowarzyszenie  “My Cork”Stowarzyszenie  “My Cork”Stowarzyszenie  “My Cork”Stowarzyszenie  “My Cork”Stowarzyszenie  “My Cork”Stowarzyszenie  “My Cork”Stowarzyszenie  “My Cork”Stowarzyszenie  “My Cork”Stowarzyszenie  “My Cork”Stowarzyszenie  “My Cork”Stowarzyszenie  “My Cork”Stowarzyszenie  “My Cork”Stowarzyszenie  “My Cork”Stowarzyszenie  “My Cork”Stowarzyszenie  “My Cork”Stowarzyszenie  “My Cork”Stowarzyszenie  “My Cork”Stowarzyszenie  “My Cork”Stowarzyszenie  “My Cork”Stowarzyszenie  “My Cork”Stowarzyszenie  “My Cork”Stowarzyszenie  “My Cork”Stowarzyszenie  “My Cork”Stowarzyszenie  “My Cork”Stowarzyszenie  “My Cork”Stowarzyszenie  “My Cork”Stowarzyszenie  “My Cork”Stowarzyszenie  “My Cork”Stowarzyszenie  “My Cork”Stowarzyszenie  “My Cork”Stowarzyszenie  “My Cork”Stowarzyszenie  “My Cork”Stowarzyszenie  “My Cork”Stowarzyszenie  “My Cork”Stowarzyszenie  “My Cork”Stowarzyszenie  “My Cork”Stowarzyszenie  “My Cork”Stowarzyszenie  “My Cork”Stowarzyszenie  “My Cork”Stowarzyszenie  “My Cork”Stowarzyszenie  “My Cork”Stowarzyszenie  “My Cork”Stowarzyszenie  “My Cork”Stowarzyszenie  “My Cork”Stowarzyszenie  “My Cork”Stowarzyszenie  “My Cork”Stowarzyszenie  “My Cork”Stowarzyszenie  “My Cork”Stowarzyszenie  “My Cork”Stowarzyszenie  “My Cork”Stowarzyszenie  “My Cork”Stowarzyszenie  “My Cork”Stowarzyszenie  “My Cork”Stowarzyszenie  “My Cork”Stowarzyszenie  “My Cork”Stowarzyszenie  “My Cork”Stowarzyszenie  “My Cork”Stowarzyszenie  “My Cork”Stowarzyszenie  “My Cork”Stowarzyszenie  “My Cork”Stowarzyszenie  “My Cork”Stowarzyszenie  “My Cork”Stowarzyszenie  “My Cork”Stowarzyszenie  “My Cork”Stowarzyszenie  “My Cork”Stowarzyszenie  “My Cork”Stowarzyszenie  “My Cork”Stowarzyszenie  “My Cork”Stowarzyszenie  “My Cork”Stowarzyszenie  “My Cork”Stowarzyszenie  “My Cork”Stowarzyszenie  “My Cork”Stowarzyszenie  “My Cork”Stowarzyszenie  “My Cork”Stowarzyszenie  “My Cork”Stowarzyszenie  “My Cork”Stowarzyszenie  “My Cork”Stowarzyszenie  “My Cork”Stowarzyszenie  “My Cork”Stowarzyszenie  “My Cork”Stowarzyszenie  “My Cork”Stowarzyszenie  “My Cork”Stowarzyszenie  “My Cork”Stowarzyszenie  “My Cork”Stowarzyszenie  “My Cork”Stowarzyszenie  “My Cork”Stowarzyszenie  “My Cork”Stowarzyszenie  “My Cork”Stowarzyszenie  “My Cork”Stowarzyszenie  “My Cork”Stowarzyszenie  “My Cork”Stowarzyszenie  “My Cork”Stowarzyszenie  “My Cork”Stowarzyszenie  “My Cork”Stowarzyszenie  “My Cork”Stowarzyszenie  “My Cork”Stowarzyszenie  “My Cork”Stowarzyszenie  “My Cork”Stowarzyszenie  “My Cork”Stowarzyszenie  “My Cork”Stowarzyszenie  “My Cork”Stowarzyszenie  “My Cork”Stowarzyszenie  “My Cork”Stowarzyszenie  “My Cork”Stowarzyszenie  “My Cork”Stowarzyszenie  “My Cork”Stowarzyszenie  “My Cork”Stowarzyszenie  “My Cork”Stowarzyszenie  “My Cork”Stowarzyszenie  “My Cork”Stowarzyszenie  “My Cork”Stowarzyszenie  “My Cork”Stowarzyszenie  “My Cork”Stowarzyszenie  “My Cork”Stowarzyszenie  “My Cork”Stowarzyszenie  “My Cork”Stowarzyszenie  “My Cork”Stowarzyszenie  “My Cork”Stowarzyszenie  “My Cork”Stowarzyszenie  “My Cork”Stowarzyszenie  “My Cork”Stowarzyszenie  “My Cork”Stowarzyszenie  “My Cork”Stowarzyszenie  “My Cork”Stowarzyszenie  “My Cork”Stowarzyszenie  “My Cork”Stowarzyszenie  “My Cork”Stowarzyszenie  “My Cork”Stowarzyszenie  “My Cork”
info@mycork.org;Stowarzyszenie “Biblary”
polskaszkolaclonmel@gmail.com;Stowarzyszenie Clonmel Polish School
bdorda@siptu.ie;Stowarzyszenie Lekarzy Polskich w Irlandii
kontakt@psletterkenny.eu;Stowarzyszenie Little Homeland - Ma³a Ojczyzna
polishgroup@localise.ie;Stowarzyszenie Polsko – Irlandzkie w Galway
hq@mymind.org;Stowarzyszenie Psychologów Polskich w Irlandii
schoollaois@hotmail.com;Stowarzyszenie Wspólnota Polska w Laois
szkola@polskaszkoladublin.org;Szkolny Punkt Konsultacyjny przy Ambasadzie RP w Dublinie
admin@irlelandpoland.com;The Ireland Poland Business Association
ips.dublin@gmail.com;Towarzystwo Irlandzko-Polskie w Dublinie
robertgardineruper@gmail.com;Towarzystwo Jezusowe (Jezuici) w Irlandii
slowo@polskakongressen.org;Towarzystwo Przyjació³ Fundacji Jana Paw³a II w Irlandii
dublindominikanie@gmail.com;Zakon Braci Kaznodziejów (Dominikanie) w Irlandii
iglinski@optusnet.com.au;Stowarzyszenie Polaków w Fiordach Zachodnich
hjalp@vodafone.is;Stowarzyszenie Polonii Islandzkiej
szkola@szkolapolska.is;Stowarzyszenie Przyjació³ Polskiej Szko³y w Reykjaviku
oldutunsskoli@oldutunsskoli.is;Szko³a Podstawowa Öldutúnskóli
szkola@szkolapolska.is;Szko³a Polska w Reykjaviku
prowincjal@tchr.org.uk;Towarzystwo Chrystusowe dla Polonii Zagranicznej (Chrystusowcy) na Islandii
pacwash@polamcon.org);Towarzystwo Kulturowe "Rejs” w Reykjanesbaer
pms@grodno.by;Towarzystwo PrzyjaŸni Islandzko-Polskiej
admin@polcannet.com;"Cusin” Biuletyn
webmaster@kontakty.org;"Nowiny – Nowy Kurier”
emigracja@episkopat.pl;Polska Misja Katolicka w Izraelu
jzastocki.rada@gmail.com;Towarzystwo Polonijne "Piast” w Izraelu
inquiries@klikdotsystems.jp;Forum Polonijne "Tama" w Japonii
poloniajaponica@gmail.com;gazeta.jp Polonia Japonica
tokio@pot.gov.pl;Polski Oœrodek Informacji Turystycznej w Japonii
razemwjaponii@gmail.com;Stowarzyszenie Polonijne Razem  w Tokio
redakcja@konnichiwa.pl;Wortal Konnichiwa
misje.aniol@o2.pl;Zgromadzenie Sióstr od Anio³ów w Kamerunie
domgen@dominikanki.pl;Zgromadzenie Sióstr œw. Dominika (Dominikanki) w Kamerunie
admin@biulpol.neT;"Biuletyn Polonijny”
p4lowicz@gmail.com;"Dziedzictwo” Biuletyn Organizacyjny
redakcja@gazetagazeta.com;"Gazeta” Dziennik Polonii w Kanadzie
webmaster@polishcanadians.ca;"G³os Polski”
zkopc549@rogers.com;"Kurier”
mazur.dance@gmail.com;"Mazur" Polish Canadian Dancers of Edmonton Society
zg@znp.ca;"Myœl” Biuletyn Zwi¹zku Nauczycielstwa Polskiego w Kanadzie
redakcja@panoramapolska.ca;"Panorama Polska" Niezale¿ny Magazyn Kulturalny
peter.nawrot@hc.sc.gc.ca;Biuletyn Stowarzyszenia In¿ynierów Polskich w Kanadzie
skrzypinski@shaw.ca;Canada-Poland Chamber of Commerce in Montreal
info@canada-poland.com;Canada-Poland Chamber of Commerce of Toronto
admin@radiomaryjachicago.org;Centrala Radia Maryja w Toronto
info@biblioteka.info;Cmentarz weteranów "Field of Honour" w Pointe Claire
ewazadar@hotmail.com;Federacja Polek w Kanadzie
kongres@kpk.org;Fundacja Charytatywna Kongresu Polonii Kanadyjskiej
foundation@kresy-syberia.org;Fundacja Kresy-Syberia Oddzia³ w Kanadzie
turzanskifoundation@rogers.com;Fundacja W³adys³awa i Nelli Turzañskich w Toronto
cpmf@millenniumfund.ca;Fundusz Wieczystego Millenium Polski Chrzeœcijañskiej
klubgpedmonton@gmail.com;Kanadyjska Fundacja Dziedzictwa Polsko-¯ydowskiego w Montrealu
institute@canadianpolishinstitute.org;Kanadyjsko-Polski Instytut Badawczy (KPIB)
skrzypinski@shaw.ca;Canada-Poland Chamber of Commerce in Montreal
klubgp_calgary@yahoo.com;Klub Gazety Polskiej - Calgary
klubgpedmonton@gmail.com;Klub Gazety Polskiej - Edmonton
klubgpkingston@gmail.com;Klub Gazety Polskiej - Kingston
klubgplondyn@gmail.com;Klub Gazety Polskiej - London
klubgpottawa@gmail.com;Klub Gazety Polskiej - Ottawa
klubgp.toronto@gmail.com;Klub Gazety Polskiej - Toronto
kgwestcan@gmail.com;Klub Gazety Polskiej – Vancouver
kgpwinnipeg@hotmail.com;Klub Gazety Polskiej - Winnipeg
info@polish-spk-foundation.org.au;Ko³o By³ych ¯o³nierzy Armii Krajowej Oddzia³ w Montrealu
president@kpk-toronto.org;Ko³o By³ych ¯o³nierzy Armii Krajowej Oddzia³ w Toronto
peter.nawrot@hc.sc.gc.ca;Ko³o Pañ przy Stowarzyszeniu In¿ynierów Polskich w Kanadzie
edesejournet@skynet.be;Ko³o Przyjació³ Fundacji Jana Paw³a II w Calgary
info@fjp2.ca;Ko³o Przyjació³ Fundacji Jana Paw³a II w Montrealu
edesejournet@skynet.be;Ko³o Przyjació³ Fundacji Jana Paw³a II w Toronto
stefan.wladysiuk@mail.mcgill.ca;Ko³o Przyjació³ Fundacji Jana Paw³a II w Winnipegu
schr@avalon.sul.com.br;Komitet Pomocy Polskim Misjom w Ottawie
glospolski@ciudad.com.ar;Konferencjê Polskich Kap³anów na Wschodni¹ Kanadê
webszefowa@zhpkanada.ca;Organizacja Przyjació³ Harcerstwa w Kanadzie
webszefowa@zhpkanada.ca;Organizacja Starszego Harcerstwa w Kanadzie
parish@holyghost.ca;Parafia Ducha Œwiêtego w Winnipeg
office@mbkp.com;Parafia Matki Bo¿ej Królowej Polski w Edmonton
patriota@net4.pl;Parafia pw. Œw. Jacka Odrow¹¿a w Ottawie
ojanusz@swjacek.ca;St. Hyacinth RC Polish Church
parafia@kazimierz.org;Parafia œw. Kazimierza w Toronto
kolbe@kolbe.ca;Parafia œw. Maksymiliana Kolbe w Mississauga
heritage@wilno.org;Park i Muzeum Polskich Kaszubów w Kanadzie
info@pcjazzsociety.ca;Polish Canadian Jazz Society
polonianorth.ca@gmail.com;Polonia North w Bolton
bogdan@softfornet.com;Polonijny Biuletyn Informacyjny w Winnipegu
jurek.orlowski@gmail.com;Polska  Biblioteka im. Miko³aja Reya w Kitchener
biuro@polskafundacja.org;Polska Fundacja Spo³eczno-Kulturalna w Quebecu
info@domksiazki.com;Polska Ksiêgarnia w Toronto
trojca.montreal@yahoo.ca;Polska Liga Katolicka w Kanadzie
resaszramek@yahoo.ca;Polska Szko³a Blessed Teresa of Calcutta w Mississauga
e_iwanicka@hotmail.com;Polska Szko³a Gr.II  ZPwK w Hamilton
st.stanislaus@rogers.com;Polska Szko³a Holy Angels w Etobicoke
psbayonnenj@yahoo.com;'Polska Szko³a im. All Saint''s w Toronto'
teresaszramek@yahoo.ca;Polska Szko³a im. Divine Mercy w Mississauga
kontakty@emiliaplater-montreal.com;Polska Szko³a im. Emilii Plater w Montrealu
plszk_gensikorski@hotmail.com;Polska Szko³a im. Gen. W³adys³awa Sikorskiego w Montrealu
kubickaa@yahoo.com;Polska Szko³a im. I. Paderewskiego w Brampton
af736@freenet.carleton.ca;Polska Szko³a im. Jana Brzechwy w Milton
i.gosiewska@odraniemen.org.;Polska Szko³a im. Jana Paw³a II w Calgary
szkolaJP2@citinet.net;Polska Szko³a im. Jana Paw³a II w Montrealu
evasobula@yahoo.com;Polska Szko³a im. Jana Paw³a II w Toronto
polishschooledmonton@gmail.com;Polska Szko³a im. Marii Chrzanowskiej w Edmonton
polskaszkola_willesden@hotmail.com;Polska Szko³a im. Marii Konopnickiej w Oakville
kontakt@szkolakonopnickiej.org;Polska Szko³a im. Marii Konopnickiej w St. Catharines
teresaszramek@yahoo.ca;Polska Szko³a im. Mary Fix w Mississauga
teresaszramek@yahoo.ca;Polska Szko³a im. St. John the Baptist Intern. Language School w Bolton
polishradio@cjam.ca;Polska Szko³a im. Œw. A. Boboli w Winnipegu
jolamalek@onet.eu;Polska Szko³a im. Œw. Ducha w Winnipegu
polskaszkola.aberdeen@gmail.com;Polska Szko³a im. Œw. Józefa w Woodstock
kierownik@szkolanatrojcowie.com;Polska Szko³a im. Œw. Trójcy w Windsor
contact@polska-szkola.com;Polska Szko³a St. Charles Mountain w Hamilton
e_iwanicka@hotmail.com;Polska Szko³a Œrednia Orl¹t Lwowskich (Red Hill Sch.) w Hamilton
szkolasaskatoon@gmail.com;Polska Szko³a w Saskatoon
info@biblioteka.info;Polski Instytut Naukowy (PINK) i Biblioteka im. Wandy Stachiewicz w Kanadzie
polishhuntingclubofcanada@mail.com;Polski Klub Myœliwski w Kanadzie
vp.students@utoronto.ca;Polski Klub Studencki przy Uniwersytecie w Toronto
webmaster@poloniabusiness.com;Polskie Stowarzyszenie Narodowe i Ko³o Pañ w London
andre.polishcom@shaw.ca;Polskie Towarzystwo "Zgoda” w Vancouver
atdanuszka@shaw.ca;Polskie Towarzystwo Gimnastyczne "Sokó³” w Winnipeg
kpk.media@yahoo.com;Polskie Towarzystwo Muzyczne im. I. J. Paderewskiego w Winnipegu
zawisza@pcyczc.com;Polsko - Kanadyjski Jacht Klub "Bia³y ¯agiel" w Toronto
cphsalberta@gmail.com;Kanadyjsko - Polskie Towarzystwo Historyczne (CPHS) w Edmonton
hmiziniak@googlemail.com;Rada Polonii Œwiata
biuro@sekretariat-misyjny.pl;Stowarzyszenie Apostolstwa Katolickiego (Pallotyni) w Kanadzie
info@ycpa.ca;Stowarzyszenie Kanadyjsko-Polskich Profesjonalistów (YPCPA) w Kanadzie
szkolasaskatoon@gmail.com;Stowarzyszenie Katolickie Polaków w Saskatoon
spkottawa@rogers.com;Stowarzyszenie Polskich Kombatantów w Kanadzie
kgwestcan@gmail.com;Stowarzyszenie Polskich Kombatantów w Kanadzie Ko³o nr 3 w Vancouver
maria.byra@desjardins.com;Stowarzyszenie Polskich Lekarzy i Biologów w Montrealu
eryka.gizinska@pl.ibm.com;Stowarzyszenie Polskich Studentów przy Uniwersytecie Waterloo
frontctr@ssmu.mcgill.ca;Stowarzyszenie Polskich Studentów Uniwersytetu Mc Gill
jerrybarycki@gmail.com;Stowarzyszenie Polskiego Domu Ludowego "Dom Polski" w Windsor
eryka.gizinska@pl.ibm.com;Stowarzyszenie Polsko Kanadyjskich Lekarzy w Ottawie
institute@canadianpolishinstitute.org;Stowarzyszenie ¯o³nierzy I Dywizji Pancernej w Toronto
szkolapoloniijp2@gmail.com;Szko³a Polonii im. Jana Paw³a II w Hamilton
parish@holyghost.ca;Szko³a Œwiêtego Ducha  w Winnipeg
rehab@total—physio.com;The Polish-Canadian Bussines and Professional Association Niagara
mwojewnik@poloniawindsor.ca;The Polish-Canadian Bussines and Professional Association of Windsor
schprov@aol.com;Towarzystwo Chrystusowe dla Polonii Zagranicznej (Chrystusowcy) w Kanadzie
elsaw2011@gmail.com;Towarzystwo Kultury Polskiej w Edmonton
kustodia@franciszkanie.org;Zakon Braci Mniejszych Konwentualnych (Franciszkanie Konwentualni) w Kanadzie
walek_michalik@yahoo.ca;Zespó³ Pieœni i Tañca "Polonez”
ursulinesahj@cogeco.ca;Zgromadzenia Sióstr Urszulanek Serca Jezusa Konajacego (Urszulank szare) w Kanadzie
domgen@dominikanki.pl;Zgromadzenie Sióstr œw. Dominika (Dominikanki) w Kanadzie
webszefowa@zhpkanada.ca;Zwi¹zek Harcerstwa Polskiego poza Granicami Kraju Oddzia³ Kanada
kch@zhr-kanada.org;Zwi¹zek Harcerstwa Rzeczypospolitej w Kanadzie
cmarg7608@yahoo.ca;Zwi¹zek Narodowoœci Polskich w Kanadzie
i.malinowski@znp.ca;Zwi¹zek Nauczycielstwa Polskiego w Kanadzie
zwiazekpolakowkz@mail.ru;Aktiubiñskie Polskie Narodowo-Kulturalne Centrum "Œwiat³o"
pskoodrodzenie@wp.pl;Centrum Kultury Polskiej w A³maty
gazetaglospolski@mail.kz;Dom Kultury Polskiej przy Parafii Rzymskokatolickiej pw. œw. Ap. Piotra i Paw³a w Czka³owie
zwiazekpolakowkz@mail.ru;D¿ambulskie Obwodowe Polskie Centrum Kultury
cssr-kz@mail.ru;Parafia Trójcy Œwiêtej w Pietropaw³owsku
i.gosiewska@odraniemen.org;Polski Spo³eczny Fundusz "Rodacy” w Szczuczyñsku
